Name,Description,Link
Email Open Tracking Transparent Pixel,"This n8n workflow creates and serves a 1x1 transparent PNG tracking pixel via webhook to detect email opens. It uses n8n nodes to decode base64 image data, convert to binary, and respond with the image. Includes logging placeholder and supports capturing userId via query parameter.",https://drive.google.com/file/d/1T5dnf7cy5tmMY9_dJHZpQqoUoPV8Olks/view?usp=sharing
Email Bounce & Open Event Receiver,"An n8n workflow using Postmark API webhook to receive real-time notifications for email bounce and open events, enabling users to track email engagement and delivery status automatically.",https://drive.google.com/file/d/1G2H5ZAawlZJq4DbZzH0-Ei9ZvKgu-0xa/view?usp=sharing
Email Verification with Hunter API,"Automates email verification using Hunter API in an n8n workflow. Triggered manually, it validates the format and existence of an email address to reduce bounce rate and improve outreach accuracy.",https://drive.google.com/file/d/1qF434bUMEE5Vu94L_MbbmZujqdVaDpyd/view?usp=sharing
Mautic Contact Email Validation Alert,"Automates validation of new Mautic contacts' emails using One Simple API. Triggers on new contact creation, verifies email quality and domain, and sends alerts to Slack for suspicious addresses. Integrates Mautic, One Simple API, and Slack for lead quality control.",https://drive.google.com/file/d/1P1uiP4A8x_HtwnWwTuPWjS0-o7-u_cfQ/view?usp=sharing
Automated Website Change Spy & Email Alerts,"An n8n workflow that automates detecting changes on specified websites using Firecrawl scraping API, compares content over a day, uses OpenAI GPT-4 models to analyze differences, and conditionally sends detailed Gmail alerts. Integrates OpenAI, Firecrawl, and Gmail for spy-like website monitoring.",https://drive.google.com/file/d/1b2u0gwK6DRLudTQHpQ8ndLM-BdHsDAjf/view?usp=sharing
Uber Eats Email Expense Logger,"Automates extraction of Uber Eats order details from Gmail emails and sends formatted expense info to Slack with Moze app links, using Gmail and Slack APIs within n8n workflow for seamless delivery expense tracking.",https://drive.google.com/file/d/1VqRWz2674H-NPVx5IHaciKi5wnnlorXA/view?usp=sharing
Sign-in IPs Report & Email Automation,"Automates retrieval of sign-in events via SaaS Alerts API, deduplicates IP data, converts to CSV, encodes base64, and emails the report using SMTP2Go. Includes an auth form for API key and email input for last 24h sign-in IP info delivery.",https://drive.google.com/file/d/1FGefCF4YlzKgpus4jCY2-fmL-nADRXl0/view?usp=sharing
Icypeas Email Verification (Single),"n8n workflow to verify a single email using Icypeas API. It authenticates with API key, secret, and user ID using HMAC-SHA1 signature, then sends a POST request to Icypeas email verification endpoint. Useful for integrating email validation in automation.",https://drive.google.com/file/d/1Um2QS7CxoqdeAstnKgdqYr6mrblfwo1W/view?usp=sharing
Forward Netflix Emails via Gmail and Mailjet,"Automates forwarding Netflix emails from a Gmail account to multiple recipients using Gmail API and Mailjet. Detects Netflix emails via Gmail trigger, splits recipient list, and sends personalized forwards via Mailjet SMTP API for seamless multi-recipient delivery.",https://drive.google.com/file/d/1qQeu1MEvqItAx6q1sxLr20TlUImL013k/view?usp=sharing
Gmail JSON Email to CSV Exporter,"Automates extraction of the latest JSON email from Gmail using OAuth2, processes its binary data, and exports content into a CSV spreadsheet file using n8n's Gmail and spreadsheet nodes. Ideal for email-driven data workflows.",https://drive.google.com/file/d/1TcskBC0R99c-IVP2sIXRRETMU_0dAtcy/view?usp=sharing
Send Gmail Email with Embedded Image,"An n8n workflow using Gmail API, HTTP Request, and base64 encoding to send an email with embedded images. Fetches an image from a URL, converts it to base64, composes MIME email with inline image, and sends via Gmail OAuth2.",https://drive.google.com/file/d/1F8R8fqNFQSV5NXR3yPmC8hRz0FFBrpi7/view?usp=sharing
Monthly Absence Summary Email Automation,"Automates monthly extraction of absence data (holidays & illness) from Google Calendar, summarizes days absent per person, and emails payroll. Built with n8n using Google Calendar API, cron scheduler, JavaScript code nodes, and SMTP email.",https://drive.google.com/file/d/1fqxKaou8dTZhvXL9TIOl4UJj2Sx8MPUf/view?usp=sharing
Icypeas Bulk Email Search Automation,"Automates bulk email search with Icypeas API using Google Sheets. Reads names and companies from a sheet, authenticates via custom JS with API key/secret, and triggers POST requests for email search results. Tech: n8n, Google Sheets API, Icypeas API, Node.js crypto.",https://drive.google.com/file/d/1zcCYtcWin-XC057tMSrbCecRgtVOCame/view?usp=sharing
Monthly Event Scraper & Email Newsletter,"Automates scraping of monthly event listings from a location-specific website using HTTP requests and HTML extraction; processes event data, formats it into an HTML email, and sends via Gmail. Ideal for keeping informed about local events monthly.",https://drive.google.com/file/d/1xK3_mjNzD6uM1ok6bq2LOLjUC6zrBgFp/view?usp=sharing
Email to HTML Webpage via GitHub & Telegram,"Automates converting incoming IMAP emails into private GitHub Gist HTML pages and sends a Telegram notification with a link. Uses IMAP for email, GitHub API for gist creation/deletion, and Telegram Bot API for notifications and message lifecycle management.",https://drive.google.com/file/d/1Y3Z4dq8pJ1fWHIhNzpLAp3ZXPhn5zXXB/view?usp=sharing
Fastmail Masked Email Management,"An n8n workflow leveraging Fastmail API to manage masked email addresses: create, update, delete, and list. It uses HTTP Request nodes with Fastmail JMAP API, a webhook secured by basic auth, and generates an interactive HTML table for email states.",https://drive.google.com/file/d/1XiLhTHWavpijetZ6ubNI6E5yabZ6jHYa/view?usp=sharing
PG&E Daily Energy Cost Email Reporter,"Automates daily login to PG&E's mobile website to extract electricity and gas cost data, formats it into an HTML email, and sends it via Gmail. Uses n8n's AirTop nodes for browser automation and Gmail API for emailing.",https://drive.google.com/file/d/1WQWFqpiYqBQf6Ro7jP95919NIvzETb1L/view?usp=sharing
Google Maps Email Scraper,"An n8n workflow automating email extraction from Google Maps business listings. It uses HTTP requests to search Google Maps for queries, scrapes URLs and emails with regex, filters duplicates and irrelevant data, and saves results to Google Sheets.",https://drive.google.com/file/d/1Xd114xceLmmk1nHJv8_xhDcbj9Z_SXRU/view?usp=sharing
Website Email Scraper API via Webhook,"An n8n workflow that scrapes emails from any website URL passed as a query parameter to a webhook. It uses HTTP Request to fetch website HTML, regex to extract emails, removes duplicates, and returns the emails in the webhook response. No external API needed.",https://drive.google.com/file/d/1vLcV9TyAL6_IYFfUL_3SbAeoM6WiBjA-/view?usp=sharing
Mailchimp Email Subscriber Add,An n8n workflow that automates adding subscribers to a Mailchimp email list via API. Uses Mailchimp node triggered manually to subscribe an email with merge field data. Ideal for simple email marketing subscriber management.,https://drive.google.com/file/d/1Avd3V9UQVwfOJqQqT3zfikVrNnZdaRAW/view?usp=sharing
AWS SES Email Sender Workflow,"An n8n workflow to send emails via AWS SES. Triggered manually to send predefined messages to multiple recipients using AWS SES API, useful for automated email notifications or testing email sending automation.",https://drive.google.com/file/d/1r-irsTNxwq8evwZG1wBrHYXiASuWKWeO/view?usp=sharing
IMAP Email Fetcher,"Workflow to fetch emails from an IMAP server using n8n's Email Read IMAP node. It connects to an email inbox via IMAP protocol, enabling automated email retrieval for further processing or automation tasks. Uses n8n automation platform with IMAP credentials.",https://drive.google.com/file/d/1bX-2zOqB9kVXVAc4h7okxaaZ9N-HfJF3/view?usp=sharing
Automated Email Excuse Responder,"This n8n workflow automatically reads emails from a specific IMAP inbox, filters emails from a particular sender, generates randomized excuses using data from an Excel spreadsheet, replies to the sender via SMTP, and sends notifications to Slack channels. It integrates Email (IMAP/SMTP), Excel parsing, Slack API, and custom JavaScript logic to automate personalized email replies.",https://drive.google.com/file/d/12twayn4nhuxUjMKixqQ5EFbSRtbOrRrU/view?usp=sharing
n8n Workflow Error Email Notifier,"An n8n workflow that triggers on workflow errors and sends detailed error reports via Gmail API. It captures error messages, execution details, and stack traces, emailing them to specified recipients to facilitate quick debugging and monitoring.",https://drive.google.com/file/d/1E5dWF8zAB02-1rupxkr2aDzhqvKHBp57/view?usp=sharing
Autopilot Email List & Contact Management,"An n8n workflow using Autopilot API to list email lists, add contacts to lists, update contact details, and retrieve all contacts from a list. Automates email marketing list and contact management with step-by-step Autopilot API integration.",https://drive.google.com/file/d/1fyMVUurZp-4wtRTXPPumxqp9WKpLQEvg/view?usp=sharing
Email Body Parser Workflow,"An n8n workflow that extracts structured data from raw email bodies by parsing labeled fields using a custom JavaScript snippet. It uses n8n's Manual Trigger, Set, and FunctionItem nodes to process emails with labels like Name, Email, Subject, and Message.",https://drive.google.com/file/d/1eNq-mLjS-1vWxRETwaYDFPZsbGH9oWL5/view?usp=sharing
Freshdesk Ticket Fetcher by Email,An n8n workflow that fetches open Freshdesk tickets for a requester based on their email. Uses Freshdesk API integrated into n8n with a manual trigger to initiate the process. Ideal for customer support automation and ticket management.,https://drive.google.com/file/d/1aAPhNrB063aN2pN-KhAdFQDsDYYnHjVN/view?usp=sharing
Icypeas Email Search Automation,"Automates performing single email searches using the Icypeas API via n8n. Utilizes API key, secret, and user ID for authentication, generates HMAC signatures, and executes secured HTTP POST requests to fetch email data based on lastname, firstname, and company/domain inputs.",https://drive.google.com/file/d/1hjYNlRATrz6Xj-tV7z4MWTlt8M1-K41r/view?usp=sharing
Email Domain Extractor,"An n8n workflow that extracts the domain name from a given email address using built-in nodes: Manual Trigger, Set (to input sample email), and Function (to process and extract domain). Helps automate email parsing tasks.",https://drive.google.com/file/d/14hISATr4EQe56g_msiHrAOXIjq7yBr3w/view?usp=sharing
Manual Triggered Email via Mailjet,"An n8n workflow sending test emails using Mailjet API upon manual trigger. It demonstrates basic email dispatch with parameters for subject, message, sender, and recipient using the Mailjet credential setup.",https://drive.google.com/file/d/1FOoHybPn4jNkfn1e2J7y01Gth6uP2d75/view?usp=sharing
Mailjet Email Sent Event Trigger,"An n8n workflow that listens for 'sent' email events via Mailjet's API using the Mailjet Trigger node, enabling automation based on outgoing emails processed through Mailjet.",https://drive.google.com/file/d/1-Z8Jt18b7r1Rlsbe0n2ZiJtwzL6va2Bc/view?usp=sharing
Manual Trigger to Send Mandrill Email,An n8n workflow that sends a templated email via Mandrill when manually triggered. Utilizes Mandrill API for email delivery. Ideal for testing or sending instant notification emails using customizable templates.,https://drive.google.com/file/d/1n_Riyq2K6yK77tj2Gj4RLlhwXSb5kVvo/view?usp=sharing
Simple Email Sender via Mailgun,"An n8n workflow that sends an email using the Mailgun API triggered manually. It includes a manual trigger node and a Mailgun node to dispatch emails with specified subject, sender, and recipient.",https://drive.google.com/file/d/1zO6vhKK-7tOvRta6Yr1HGM6xPaowj2Hb/view?usp=sharing
Manual Trigger Email Sender,"An n8n workflow that sends an email upon manual execution. It uses the built-in Manual Trigger and Email Send nodes, leveraging SMTP credentials to dispatch a predefined message. Ideal for testing or simple email notifications.",https://drive.google.com/file/d/1N_TxTDPf6-sdtZx5kcZZz1wie94Z3qwI/view?usp=sharing