Name,Description,Link
Book Data Scraper to CSV & Email via Dumpling AI,"Automates scraping book data from web pages using Dumpling AI, extracts titles and prices with HTML nodes, sorts by price, converts to CSV, and emails via Gmail. Integrates Google Sheets trigger, HTTP request, HTML parsing, sorting, file conversion, and Gmail APIs for end-to-end scraping and delivery.",https://drive.google.com/file/d/1szYDyOkyHzeaZnOVljTy0zIaOkt-FVX2/view?usp=sharing
Automated AI-Powered Fact Emailer,"An n8n workflow that uses Airtable as subscriber DB, AI agents (Groq llama-3.3-70b, LangChain, OpenAI) to generate unique factoids and images, and Gmail for sending scheduled personalized educational emails with subscription management via n8n forms.",https://drive.google.com/file/d/1zLWKN4hXIKSahRF-2TKuaijWADIujTUJ/view?usp=sharing
Automated Daily Digest Email Creator,"An n8n workflow that aggregates top news from Times of India RSS, recent Gmail emails, and Todoist tasks into a styled daily summary email. Utilizes RSS Feed, Gmail API, Todoist API, and custom JavaScript for formatting and sends digest automatically via Gmail.",https://drive.google.com/file/d/1046JgjkHNIOb6yRnkV7GM5iIifU1ETLD/view?usp=sharing
Weekly SEO Report Email Automation,"An n8n workflow that automates weekly retrieval of SEO data from Google Search Console via its API, generates a summarized report of top search queries, and emails it using Gmail. Scheduled every Monday at 7AM for streamlined SEO performance monitoring.",https://drive.google.com/file/d/16VHBKZM1ZRrXBkGp_9Pdju8EePo7ATTm/view?usp=sharing
AI-Powered Outlook Email Reply Assistant,"Automates email replies by integrating Microsoft Outlook and OpenAI GPT-4o-mini via n8n. Filters emails from specific sender, generates personalized replies in your style, and drafts or sends replies automatically, enhancing email productivity.",https://drive.google.com/file/d/1I8qS7t_RJOy2cPilHAAPYZCjLdCDK4vb/view?usp=sharing
AI Email Summarizer to Messenger,"Automates reading emails via IMAP, summarizes content using Openrouter.ai's LLaMA 3.1 model, and sends concise, prioritized summaries with deadlines to LINE messenger using HTTP APIs. Useful for managing important email info in chat apps.",https://drive.google.com/file/d/1qL84fZ9lx3Ahm9IPoxaHIttf9EtCx0sg/view?usp=sharing
Google Sheets Email Validation Workflow,"Automates email validation by monitoring a Google Sheets for new entries, removing duplicate emails, verifying each email's deliverability through the Effibotics API, and updating the sheet with verification results. Utilizes Google Sheets API, HTTP request node, and email validation service.",https://drive.google.com/file/d/119iLX2ckDbg5fdpGT_2EtbWzLfeU70xg/view?usp=sharing
Email Attachment Organizer to Google Drive,"Automates saving unread Gmail attachments from a specific sender (ray.thomas@charter.com) to a designated Google Drive folder. Utilizes Gmail Trigger, file size switch-based filtering, and Google Drive API, helping to manage and categorize attachments efficiently.",https://drive.google.com/file/d/1yH7NGBfG1GA89CaFMKPpazxcptoE5DNv/view?usp=sharing
HubSpot Email Validation & Alert Workflow,"Automates validation of new HubSpot contact emails using HubSpot APIs and OneSimple API; sends Slack alerts for suspicious emails. Ensures contact email quality by checking deliverability, domain validity, and disposability, improving CRM data integrity.",https://drive.google.com/file/d/1iVAwcQrdLCxW6s_LXKHcLmEJOUCcJ5My/view?usp=sharing
Email to Google Sheets Logger,"Automates saving incoming Gmail emails into Google Sheets as new rows, capturing sender, subject, and snippet. Uses Gmail Trigger and Google Sheets API via OAuth2. Ideal for email logging, lead tracking, and structured email record-keeping.",https://drive.google.com/file/d/11iVPRChnsPc3IL62oP75C3WSlIRFjHO_/view?usp=sharing
Lemlist & HubSpot Email Reply Automation,"Automates lead reply categorization and follow-up creation using Lemlist API, HubSpot CRM, and OpenAI GPT-3 for reply analysis. It unsubscribes, tags replies as interested or out-of-office, and creates deals/tasks in HubSpot, enhancing sales workflows.",https://drive.google.com/file/d/11uH6x_6cMvEAXdrFQ5q8xIB2oXLSdlfU/view?usp=sharing
Email Sales Opportunity Summarizer & Odoo Creator,"Automates capturing sales emails via Gmail API, summarizes inquiry details using OpenAI GPT-3.5, and creates sales opportunities in Odoo CRM. Integrates Gmail, OpenAI language model, and Odoo ERP to streamline lead management and enhance sales pipeline efficiency.",https://drive.google.com/file/d/10oW22N7SJOINl4_8MdtIWL1KnKYyr4KD/view?usp=sharing
Gmail to Notion Automated Email Processing,"Automates converting Gmail emails into structured Notion pages using Gmail API, Airtable for route management, OpenAI GPT-4o for email summarization and task extraction, and Notion API. Filters and labels emails to prevent duplicates, sends error notifications, and manages active workflows.",https://drive.google.com/file/d/1xKuVuuBwNhgyKU0MPiEPEUlB1iOcUQar/view?usp=sharing
Gmail Email Header Authentication Analyzer,"Automates email header analysis using Gmail webhook or trigger in n8n. Extracts originating IP, queries IPQualityScore and IP-API for reputation and geolocation, evaluates SPF, DKIM, DMARC headers, and compiles authentication results for webhook integration.",https://drive.google.com/file/d/1gFHvOHF2AUTnR9TIgbz9NrrsnqYipY26/view?usp=sharing
EDI Order Email Processor with Google Sheets,"Automates processing of EDI order emails via Gmail API, parses EDI messages using JavaScript code, filters orders by type, and appends detailed order data into separate sheets in Google Sheets for return and outbound orders. Utilizes n8n, Gmail Trigger, JS parsing, and Google Sheets API.",https://drive.google.com/file/d/1xfki4yKN6fV8Ecjq4GL8V3sxkStj8zn-/view?usp=sharing
Email to Todoist Task Automation,"Automates converting Gmail emails into Todoist tasks using n8n workflow with Gmail API, Todoist API, and OpenAI's GPT-4 mini model. Summarizes email content, proposes actions, and manages task lifecycle for efficient email-task integration.",https://drive.google.com/file/d/1neQ9Wz17Z-oFniJJL4ckGeawVHAvdGoX/view?usp=sharing
Email To-Do ➔ Google Tasks Automation,"Automates task creation by capturing Gmail emails labeled 'To-Do' using Gmail API and creating Google Tasks via Google Tasks API. Utilizes n8n workflow with OAuth2 credentials for seamless integration, helping users turn emails into actionable tasks effortlessly.",https://drive.google.com/file/d/1paV35xql64ukqDxRC6tYBW3NOw8-QHiL/view?usp=sharing
AI Email Auto-Reply and Feedback Logger,"Automates email replies using OpenAI GPT via Gmail trigger; stores incoming emails, generated replies, and feedback in Google Sheets for fine-tuning. Utilizes Gmail OAuth2, OpenAI API, and Google Sheets OAuth2 for seamless AI-driven email handling and feedback recording.",https://drive.google.com/file/d/1xmCQGaZ6f0jiWvJZZhbDIFlL8mNvdZq0/view?usp=sharing
Gmail to Notion Email Archiver,"Automates archiving labeled Gmail emails to a Notion database by creating pages for new emails and removing labels when marked done. Uses Gmail API and Notion API, triggered every minute for timely email management and productivity.",https://drive.google.com/file/d/10eqCeQHcg2-YYHgqsh8uZY8p-tfxhNGP/view?usp=sharing
AI-Driven Personalized Marketing Emails,"An n8n workflow that automates personalized marketing email campaigns using LangChain and OpenAI GPT-4-mini. It analyzes customer purchase and feedback data, generates tailored email content, and conditionally adds coupons. Includes email HTML templating and SMTP sending via n8n.",https://drive.google.com/file/d/1iF7ziu4_c6-I8AHW0bb_pWtC3A8XOXGr/view?usp=sharing
TTS Voice & Email Verification Automation,"Automates sending TTS voice calls via ClickSend API and email verification through SMTP for secure user verification. Features form input, code generation, voice & email code verification, and user feedback. Tech: n8n, ClickSend API, SMTP, JavaScript.",https://drive.google.com/file/d/1BqHfgCeEn7jzZHnveQ8witfJKIts9EyX/view?usp=sharing
Automated Customer Email Sender via Google Sheets,"An n8n workflow automating personalized Gmail email sending by retrieving customer message details from Google Sheets, filtering data by status and current date, sending emails using Gmail API, and updating the sheet with send status for organized outreach campaigns.",https://drive.google.com/file/d/1wp3EiHkGwreP26fT4IYcRVA-ihaMS1gt/view?usp=sharing
AI Support Agent with Email Verification & Slack Alert,"An AI agent workflow using OpenAI GPT-4o-mini and LangChain framework in n8n. It checks user input for an email, prompts for it if missing, or alerts a Slack channel for human support. Integrates chat triggers, memory buffer, and conditional logic for support escalation.",https://drive.google.com/file/d/1anQLXOTS_V4cyhyk3tWoHdiLVSeVdEs9/view?usp=sharing
B2B Lead Qualification & Email Response,"An n8n workflow to capture business leads via a form, enrich contact and company data using Clearbit API, filter for B2B companies with over 499 employees, then send tailored Gmail responses. Tech stack includes n8n, Clearbit API, and Gmail SMTP.",https://drive.google.com/file/d/1s_pHfYsi6__KULkHBGLzq0_RBS611pRW/view?usp=sharing
LinkedIn Email Finder & Enricher via Google Sheets,"Automates enriching LinkedIn profile data by fetching contact details using Prospeo.io LinkedIn Email Finder API, triggered on schedule, reading/writing Google Sheets for scalable contact info updates with fields like email, name, gender, job title, skills, education, and picture.",https://drive.google.com/file/d/1qR7CwCjiTLaAuej0Z43Tk1gQUtsoyWg1/view?usp=sharing
Email Lead Validation and Enrichment,"n8n workflow that triggers from a form submission, verifies email validity using Hunter API, enriches person and company data via Clearbit, and adds valid leads to HubSpot CRM. Integrates Form Trigger, Hunter, Clearbit, and HubSpot with OAuth2 for smart lead collection.",https://drive.google.com/file/d/1KbjU7wY14TzTDrk5D_quuz_KjnyjeEzZ/view?usp=sharing
GitHub Release Email Notifier,"An n8n workflow that daily fetches the latest release info from a GitHub repo, converts release notes from markdown to HTML, and emails the formatted update via Gmail. Utilizes GitHub API, markdown conversion, and Gmail OAuth2 for automated release notifications.",https://drive.google.com/file/d/1-BjLmnl8sN675tBeQ0kKRKm5E-AdbujN/view?usp=sharing
Daily Airtable Order Summary Email,"Automates collecting orders stored via webhook into Airtable, then sends a daily 7PM email summary with all today's orders in HTML table format using Airtable API and Gmail. Helps businesses track and review daily sales efficiently.",https://drive.google.com/file/d/1FRce01ziYDyA-EOdiqERjySOxFzDmB_4/view?usp=sharing
Weekly Notion Task Summary Email & Push,"Automates weekly retrieval of tasks from Notion, filters and sorts by deadlines, generates styled HTML emails grouping overdue and upcoming tasks, and sends updates via email and Pushover push notifications. Uses Notion API, SMTP, and Pushover within n8n.",https://drive.google.com/file/d/12XalECqSPhIQBITpNQgEMDeZ_kqbq7Rr/view?usp=sharing
Fastmail AI Email Draft Assistant,"Automates drafting email replies for Fastmail using OpenAI GPT-4. Monitors IMAP inbox for new emails, extracts content, generates replies with GPT-4, and uploads drafts via Fastmail's JMAP API. Integrates IMAP, Fastmail API, and OpenAI in n8n workflow.",https://drive.google.com/file/d/13QlphGGW9G_OGZ54WrCitLq4YEM6uuNb/view?usp=sharing
AI-Powered Outlook Email Auto Categorizer,"Automate Outlook email management by categorizing and organizing emails into folders using Ollama AI's qwen2.5:14b model with n8n workflow. Employs Microsoft Outlook API, Markdown conversion, and advanced AI parsing for efficient inbox sorting.",https://drive.google.com/file/d/1m4aRGq3jC7rl6L1Loam9ZjxZZavgj9VH/view?usp=sharing
Inbound Order Email Parser to Google Sheets,"Automates extraction of purchase orders from Gmail emails using OpenAI's GPT-4o-mini via n8n LangChain AI Agent; parses PO number, delivery date, SKUs, quantities, then stores structured data into Google Sheets for order management.",https://drive.google.com/file/d/1kVkpN--uq1hJGnIXBQ6Kwn-xi9-vTbwJ/view?usp=sharing
CSRD Email Audit & Summary Automation,"Automates review of CSRD XHTML report emails received in Gmail. Uses Gmail API to trigger, extracts XHTML attachments, audits content for sustainability disclosures, and employs AI (LangChain + OpenAI GPT-4o-mini) to generate professional audit summary emails. Improves ESG compliance communication.",https://drive.google.com/file/d/1EYf0l6P5At5JGMP3DAVT5hJ7GoO7Hcau/view?usp=sharing
Daily Digest Email for n8n.io Templates,"Automates daily email newsletters by fetching the latest n8n.io workflow templates from selected categories stored in Excel. Uses Microsoft Excel, HTTP Request for n8n API, OpenAI GPT-4 for summaries, and Microsoft Outlook to send personalized digests to subscribers.",https://drive.google.com/file/d/1xH5bsGaKeXiupGrV_6oQCjdm5656yzPy/view?usp=sharing
Voice-to-Email Reply Assistant,"An n8n workflow automating email reply drafting by analyzing incoming Gmail messages, assessing response need via OpenAI GPT chat, sending email details to Telegram, accepting voice note replies on Telegram, transcribing audio with OpenAI Whisper, and drafting polished replies in Gmail threads.",https://drive.google.com/file/d/1yOfwmzYY0b63D0UHrBxm10D-d5eRaraj/view?usp=sharing
n8n Automated Error Analysis & Email Alert,"Automates error detection in n8n workflows via n8n API, analyzes errors using OpenAI GPT-4o with LangChain, generates detailed diagnosis and resolution, and sends formatted email alerts via Gmail. Ideal for improving workflow reliability with AI-powered insights.",https://drive.google.com/file/d/10SWMc3cVN0UKHE4tZpeXsrSz53UAp4-v/view?usp=sharing
Email Header IP & Spoofing Analyzer,"n8n workflow analyzing email headers for IP reputation and spoofing threats using IP Quality Score and IP-API, plus SPF/DKIM/DMARC authentication checks via JavaScript. Provides comprehensive email security insights via webhook responses.",https://drive.google.com/file/d/1zYQSNd-Xnq3KV-TrTdorD0P7jeBnZryk/view?usp=sharing
DMARC Report Email Parser & DB Logger,"Automates processing of DMARC reports by monitoring IMAP email for XML attachments, unzipping and parsing them into JSON, mapping the data into a MySQL database, and sending notifications via Slack/email on SPF or DKIM failures. Uses n8n automation with email, compression, XML, MySQL, and Slack nodes.",https://drive.google.com/file/d/1VFcxH163ZjV4n35rtDcQkCW0cz6m5m7k/view?usp=sharing
Google Drive AI Document Summarizer & Emailer,"Automates downloading documents from Google Drive, summarizes content using Mistral AI language model with n8n LangChain integration, and emails the summary via Gmail. Ideal for quick document insights using Google Drive, Mistral Cloud API, and Gmail OAuth2.",https://drive.google.com/file/d/1LApm_TNyt0ruRSbq02yyhtuP4iwkMLOV/view?usp=sharing
Email Chatbot with Semantic + Structured RAG via Telegram,"An advanced chatbot integrating Telegram, OpenAI, Ollama embeddings, and Postgres PGVector for hybrid semantic and SQL-based email retrieval. It handles natural language queries over email data, combining vector search and SQL for precise and contextual answers.",https://drive.google.com/file/d/1sp5d9hMGmfcUNBj9lp7Jof7YJ7ZhUOEl/view?usp=sharing
Slack Notify & Jira Ticket for Quarantined Emails,"Automates incident response by notifying quarantined email recipients via Slack using Slack API and Sublime Security API, and creates Jira tickets for opened suspicious emails. Integrates Sublime Security webhook, Slack user lookup, and Jira Software Cloud for security alert management.",https://drive.google.com/file/d/1dLl610bkgHvg6siE8VKUng_-KW5NGrxr/view?usp=sharing
Gmail Email Classification & Labeling,"Automate Gmail email classification using Google Gemini and LangChain AI. Categorizes emails into High Priority, School Related, Promotion, or Other, then applies Gmail labels via OAuth2. Ideal for organizing and prioritizing inbox with AI-driven text classification.",https://drive.google.com/file/d/1pWTfqubw6tJ9ayUcX8KB-f1RujUaGHdH/view?usp=sharing
Email Invoice & Payment Extractor with LLM,"Automates extraction of transaction details from labeled Gmail invoices and payment emails using n8n. Uses Gmail API triggers, PDF extraction, HTML parsing, Google Gemini and Groq LLMs with structured output parsers, then logs data to Google Sheets for finance management.",https://drive.google.com/file/d/1Zn5cZBqNCKV7m1yxRhQkH2B-M4R3d_D4/view?usp=sharing
Human-in-the-Loop AI Email Assistant,"Automates email reading via IMAP, summarizes with LangChain and OpenAI GPT models, drafts replies, and sends emails after human approval. Integrates IMAP, SMTP, LangChain AI nodes, and OpenAI GPT-4o-mini for professional business email handling.",https://drive.google.com/file/d/1j8_xTLX-eUSrj7CX3k8KRoVQcTO6omrc/view?usp=sharing
Email PDF Attachment Filter & Upload,"Automates filtering of PDF attachments from Gmail using OpenAI to detect relevant documents (e.g., payslips), then uploads matched PDFs to Google Drive. Uses Gmail API, OpenAI API, and Google Drive API within n8n workflow for document management automation.",https://drive.google.com/file/d/1V63tfm9kHBGtQ0iV6osvcp3T-bgIvFWC/view?usp=sharing
AI Email Summarizer & Messenger Notifier,"Automates reading emails via IMAP, summarizes content using Openrouter.ai's LLaMA model, and sends concise summaries or important alerts with deadlines to LINE messenger. Integrates IMAP, Openrouter API, and LINE Messaging API for streamlined email management.",https://drive.google.com/file/d/1UAgecYJymRhCuO3wK45NFZ-dxgIFI6Ro/view?usp=sharing
Email Verification Waitlist Automation,"Automates user registration with email verification for a waitlist using n8n. Integrates Google Sheets for data storage, SMTP for sending verification codes, and n8n Forms for user input and validation, ensuring secure and organized waitlist management.",https://drive.google.com/file/d/1VYpLgD0AkUm03mTWHbGyniApRhfEPWtg/view?usp=sharing
Social Media Lead Analyzer & Email Generator,"Automates lead outreach by extracting LinkedIn and Twitter posts via RapidAPI, analyzes data using OpenAI GPT-4, and generates personalized HTML cover letters sent via SMTP. Integrates Google Sheets for lead data and tracking, ideal for marketers and sales pros.",https://drive.google.com/file/d/16_QHpzU3JYQdZ8t0EngjGQiO5HxpZG0g/view?usp=sharing
Dartagnan to Braze Email Template Sync,"An n8n workflow automating synchronization of email templates from Dartagnan to Braze. It fetches auth tokens, lists and compares campaigns and email templates, processes HTML content including image embedding, and updates or creates templates via Dartagnan and Braze REST APIs. Runs on schedule.",https://drive.google.com/file/d/1R41tofrd85Zr99OaPtlus0vm6jjflBif/view?usp=sharing
Automated Email Categorizer & Responder,"This n8n workflow automates email handling by triggering on new Gmail messages, classifying them using Google Gemini NLP, and sending tailored responses (guest posts, YouTube inquiries, courses) via SMTP. Contacts are updated in Brevo. Tech used: Gmail API, Google Gemini, SMTP, Brevo API.",https://drive.google.com/file/d/1WNcKR0OMWwv7HSFcEBsXrRpH3Pl-fUaM/view?usp=sharing
Email Existence Verification Workflow,"An n8n workflow that verifies if an email address exists using Uproc's checkEmailExists API. It triggers manually, creates the email item, checks its deliverability status, and branches accordingly. Useful for validating emails in automation.",https://drive.google.com/file/d/1SsczU-3mvI5MP34csJLHtfCz1NXORtUP/view?usp=sharing
IP-Based Location Email Sender,"n8n workflow using Uproc API to get geographic location from IP, then sends a customized welcome email in Spanish or English via AWS SES based on user country (Spain or not). Automates localized email outreach using IP geolocation and email automation.",https://drive.google.com/file/d/1RCaPkYTt8-jjy4ERivdR7qfX9krB6Ne5/view?usp=sharing
Clearbit Email Person Lookup,"An n8n workflow that uses Clearbit API to fetch and enrich person details by email input. It triggers manually and retrieves person data like name, job, and company using Clearbit's person resource for streamlined data enrichment.",https://drive.google.com/file/d/1sANkQwNdwbO4DwQ_mcr6SD7VBeKq6TRH/view?usp=sharing
Airtable Email Validation Workflow,"An n8n workflow that fetches email records from Airtable, validates them using Mailcheck API to check MX record existence, and updates Airtable records with validation results. Tech stack includes Airtable API and Mailcheck API integration for data integrity.",https://drive.google.com/file/d/1qnvGQj-92anyVyG1vSHrSqm2WXSRNSnO/view?usp=sharing
Email Invite with iCalendar Attachment,"Automates sending an email with an iCalendar event invite using n8n. Utilizes n8n manual trigger, iCal node for calendar event creation, and SMTP email node (Outlook). Ideal for sending event invites with calendar attachments.",https://drive.google.com/file/d/1C8S8n6EpPZn4gmyKjmDdFe3qzawR1Iun/view?usp=sharing
Invoice Email to Nextcloud Uploader,"Automates fetching invoices from an IMAP 'Invoices' email folder, processes each attachment by sanitizing filenames, and uploads them to dated folders in Nextcloud. Utilizes IMAP Email node, custom JavaScript for filename sanitization, and Nextcloud API integration.",https://drive.google.com/file/d/1WzIuvlepM3X8V6GDnNZdhvzM3c-8RFcx/view?usp=sharing
Add Subscriber and Send Email Campaign,Automates adding an email subscriber to a Sendy list and sends a welcome email campaign using Sendy API triggered manually in n8n workflow.,https://drive.google.com/file/d/1nGpy58-KlhHkLlgaIlihNAYG0PBt2dEX/view?usp=sharing
Random User Data to Sheets & Email,"Automates fetching random user data from randomuser.me API, formats it, appends to Google Sheets via OAuth2, converts data to CSV and JSON files, saves locally, and emails JSON file using Gmail API. Integrates HTTP Request, Google Sheets, File, and Gmail nodes in n8n.",https://drive.google.com/file/d/1cM6qS6NNl66ZCFs8njVHF5pk_JuZSDRP/view?usp=sharing
Customer Data Invoice & Email Automation,"Automates fetching customer data, sorting, generating invoices and customer lists using n8n, a custom Customer Datastore API, Document Generator for templates, and SMTP for email delivery. Enables sending individual invoice emails and summarized new customer report emails.",https://drive.google.com/file/d/1qMd43ykNZ45uAGLo6PZNrqg7bPFIHp0f/view?usp=sharing
TwentyCRM Event Notifications to Email & Slack,"An n8n workflow that receives event triggers from TwentyCRM via webhook, filters and logs event data to Google Sheets, and sends notifications to Gmail or Slack channels based on event type (e.g. deletion events emailed, others sent to Slack).",https://drive.google.com/file/d/1tYsNWJbVoOVFnVX2SOJRmIzYf0EuH_IW/view?usp=sharing
Email to Nextcloud Deck Card,"Automates creation of Nextcloud Deck cards from emails using IMAP for email retrieval, JavaScript function to strip HTML, and Nextcloud Deck API via HTTP request for card creation. Ideal for task management workflows.",https://drive.google.com/file/d/16swR-xn6odnMHiqW_RmylIQHdCfzNYmY/view?usp=sharing
Email XML Order Processing and API Submission,"Automates order processing by reading emails via IMAP, extracting XML attachments, converting them to JSON, and sending data via HTTP POST to a sales order API. Uses n8n nodes: IMAP Email, XML, Set, HTTP Request, and Move Binary Data for seamless integration.",https://drive.google.com/file/d/1loRUjIA5VOh7vObN5_KSiKO9Bt3zaQeN/view?usp=sharing
Batch Email Sender with CSV and Image Attachments,"Automates batch email sending using n8n with CSV parsing, batch processing, and SMTP email sending. Reads CSV data, processes in batches of 5, attaches personalized PNGs per recipient, and sends certificate emails via SMTP.",https://drive.google.com/file/d/1VchI7wOEteXzahj7ZjKXKjeZLVX4RiPT/view?usp=sharing
Icypeas Real-Time Email Search Listener,"Automates real-time retrieval of email search results from Icypeas via webhook, extracting emails and names. Uses n8n webhook and Set nodes to process data for integration with services like Lemlist. Ideal for bulk email/domain scans with instant notifications.",https://drive.google.com/file/d/1qfaOwv8jZU059Mt9LQHngjvI-ajRFBvy/view?usp=sharing
Fastmail JMAP Unread Email Fetcher,An n8n workflow integrating with Fastmail's JMAP API using HTTP requests and header auth to retrieve mailbox info and fetch the latest unread emails. Designed to automate email monitoring leveraging Fastmail's API and n8n's HTTP Request nodes.,https://drive.google.com/file/d/1E1r1Yvq5PERGLWyIyRRsQx2rstlP6pYJ/view?usp=sharing
Email Validation & Domain Extraction Workflow,"An n8n workflow that validates email addresses and extracts domains using native functions. It uses n8n's manual trigger, random data generator for sample emails, and set node for processing. Ideal for quick email checks in automated processes.",https://drive.google.com/file/d/1yOYv11xsY8pWlqdDaKGRBvXR005HiQEL/view?usp=sharing
Fastmail Masked Email Generator,"An n8n workflow that creates disposable masked email addresses via Fastmail's JMAP API. Triggered by a webhook, it authenticates using HTTP header credentials, processes input state and description, generates a masked email, and responds with the details. Ideal for privacy and testing integrations.",https://drive.google.com/file/d/1n7h53F9F_QNcelnpwsNPeg0_zuH76b44/view?usp=sharing
