Name,Description,Link
Luma AI Text-to-Video Generator,"Automates video creation from text prompts with randomized camera motions using Luma AI API and stores results in Airtable. Uses HTTP API, JavaScript for randomness, Airtable integration—enabling quick generation and tracking of creative short videos.",https://drive.google.com/file/d/1O6fXn6Pak6jOhGlBG2paoYE2JGMljrlH/view?usp=sharing
Squarespace Order Fulfillment Automation,"Automates fetching and fulfilling Squarespace orders using Squarespace Commerce API with OAuth2 and API key authentication. Supports filtering by fulfillment status, pagination, and automated notification sending to customers.",https://drive.google.com/file/d/1Sd8L2CtcNynM0IPx1A8fuPjE8NR_tMbz/view?usp=sharing
Batch Processing with Anthropic Claude API,"Automates sending and retrieving multiple batched prompts to Anthropic Claude AI via its Batch API. Uses n8n with HTTP Request nodes, JavaScript code processing, and Langchain memory management for parallel prompt execution and result aggregation.",https://drive.google.com/file/d/1h45D6Yu7NVCe54NlDLrRntCckacmjLSj/view?usp=sharing
AI Resume Parsing & Client Usage Billing,"Self-hosted n8n workflow using OpenAI GPT-4o-mini via Langchain Code node to parse uploaded resume PDFs into structured JSON. Tracks token usage and costs per client, logs data to Google Sheets, and auto-generates monthly invoices via Gmail. Enables cost monitoring & billing automation for AI document extraction services.",https://drive.google.com/file/d/14hgm8QiXbV50QeKqAiiRBHwI8bjEQLN8/view?usp=sharing
Gmail Attachments to Organized Google Drive,"Automates downloading attachments from filtered Gmail emails, checks and creates company and date-based folders in Google Drive using Google Sheets for whitelist verification. Tech stack: Gmail API, Google Drive API, Google Sheets API via n8n nodes.",https://drive.google.com/file/d/1Ir9p4mTKVDQOLgfwLEttBbnwC21JoBn6/view?usp=sharing
SMS Course Assistant with Twilio & Airtable,"An automated SMS chatbot workflow using Twilio for SMS triggers, OpenAI (GPT-4) for natural language understanding, and Airtable as a course database. It fetches and answers course queries, logs interactions, and provides up-to-date academic info for Northvale Institute students.",https://drive.google.com/file/d/1iARmRicHcQkl-jx4eB41zbbsxBnoVgGN/view?usp=sharing
Retell Call Data Auto-Saver,"Automates saving Retell AI call analysis data from webhook into Airtable, Google Sheets, and Notion. Utilizes Retell webhooks, Airtable API, Google Sheets API, and Notion API to store call transcripts, summaries, sentiment, and cost details in structured databases.",https://drive.google.com/file/d/1fxZ1Qo8pp2IK1VV-9cj7tTYQIam69ZW0/view?usp=sharing
University Term Dates to Calendar ICS,"Automates extraction of term dates from university Excel files using Cloudflare Markdown Conversion, Google Gemini LLM for event extraction, and Python code to create ICS calendar files, then emails the calendar via Gmail for easy import to calendar apps.",https://drive.google.com/file/d/1bzKAJOt0ORjnhniK_EF6g5sxpJ-MsMYA/view?usp=sharing
Google Keep Notes to Google Sheets via AI,"Automates exporting Google Keep notes stored as JSON files in Google Drive, filters, processes content with OpenAI GPT-4o-mini model via LangChain AI, and appends extracted data to Google Sheets. Uses Google Drive, Google Sheets APIs, and OpenAI for text extraction and data structuring.",https://drive.google.com/file/d/1wMLNmGY_LERSPr3GSy3JXFXtmTxFeYtD/view?usp=sharing
Daily Exchange Rate Updater to Google Sheets,"Automates daily retrieval of USD currency exchange rates via ExchangeRate-API, formats data, and updates & archives it in Google Sheets. Utilizes n8n HTTP Request, Code, Google Sheets, and Schedule Trigger nodes for seamless financial data management.",https://drive.google.com/file/d/1eqqRvr2ProbK5dlThjoRH_EP7dmktE2r/view?usp=sharing
AI-Powered Daily Israeli News Digest,"Automates fetching and processing of Israeli news from Calcalist and Mako RSS feeds, uses GPT-4o to select top 5 executive-relevant articles, and generates a formatted HTML email digest sent daily via SMTP.",https://drive.google.com/file/d/1YkxbY1Cer0QX-0_FBw4hE6mAiKszjYHX/view?usp=sharing
Daily Product Hunt Data Fetcher to Google Sheets,"Automates daily retrieval of today's top Product Hunt posts using Product Hunt GraphQL API, processes product details, resolves website redirects, and stores enriched data into Google Sheets via service account. Built with n8n, HTTP requests, JavaScript code, and Google Sheets integration.",https://drive.google.com/file/d/1zNf_WDklC6fu9l4463VizoG3_veDjaUn/view?usp=sharing
Indeed Job Listing Scraper with Bright Data & LLM,"Automates job search by scraping Indeed listings using Bright Data API. Integrates n8n for workflow, Google Sheets for storage, and OpenAI GPT-4 mini model to assess applicant-job fit. Uses form trigger for search parameters and polls for data readiness.",https://drive.google.com/file/d/1s0JJ63K5hKF14WRz9VCXp6Q4ZED8-uvZ/view?usp=sharing
Glassdoor Job Listings Scraper with Bright Data,"Automates job prospecting by scraping Glassdoor job listings via Bright Data API, processes data with OpenAI GPT-4 and LangChain, and stores results in Google Sheets. Includes customizable queries via form triggers for targeted job search automation.",https://drive.google.com/file/d/1MBLIN3bFTbnzVI0Fm95b319Int9hoQyI/view?usp=sharing
Trustpilot Review Scraper & Ad Copy Generator,"n8n workflow scraping Trustpilot competitor reviews via Bright Data API, storing results in Google Sheets, filtering negative reviews, summarizing with OpenAI GPT-4o-mini, and emailing ad copy suggestions for marketing campaigns.",https://drive.google.com/file/d/1ps3kfWSoJ2hUe51afo9WOvhprVPNZPvx/view?usp=sharing
Amazon Reviews Analysis & Creative Generator,"This n8n workflow automates scraping Amazon product reviews using Bright Data API, stores data in Google Sheets, summarizes reviews with OpenAI GPT-4o-mini, generates Ads images, and emails media buyers. It leverages Bright Data API, Google Sheets, OpenAI GPT, and Gmail for competitive review analysis and marketing creative generation.",https://drive.google.com/file/d/1gRiMJVrnDZzWuaRtX2-QLSUDEAvMshVK/view?usp=sharing
PostgreSQL MCP Server for DB Management,"An n8n workflow acting as a PostgreSQL MCP server enabling secure database management operations (select, insert, update) via MCP clients like Claude Desktop. Uses n8n nodes (Postgres, LangChain MCP Trigger/Tools), avoids raw SQL for security and supports schema introspection.",https://drive.google.com/file/d/1pcX8akeehG0wKRMCOmFOJmHMQnQm3jD9/view?usp=sharing
Qdrant MCP Server for Review Analysis,"An n8n workflow implementing a customized MCP server to extend Qdrant's vector database features with review database management. Utilizes OpenAI for embeddings and Qdrant API for advanced search, grouping, and recommendation functionalities to handle, search, compare, and recommend customer reviews.",https://drive.google.com/file/d/1fRmlpziR0XujyIelahQRD27sAhUsCtr_/view?usp=sharing
PayCaptain Employee MCP Server,"n8n workflow creates an MCP server for PayCaptain payroll, enabling employee search, lookup, and updates via the PayCaptain API. Uses MCP Server Trigger, HTTP Request, Google Sheets (for logs), and LangChain tool workflows. Ideal for payroll automation with audit logging.",https://drive.google.com/file/d/1fwDoQwxCQBhdPZGW_8bT8zm73TpuqVn3/view?usp=sharing
EU Sustainability Legislative Scraper & Tracker,"An n8n workflow that scrapes EU parliamentary legislative procedures from an official site, uses OpenAI GPT-4 Turbo to classify sustainability-related items, records filtered results in Google Sheets, and creates Google Tasks for study reminders. Tech stack: HTTP request, HTML parsing, OpenAI API, Google Sheets, Google Tasks.",https://drive.google.com/file/d/1geOdACs978whyrWk_liXGygQ15pVDIGM/view?usp=sharing
EU Sustainability News Daily Digest,"Automates daily scraping of EU news, classifies sustainability articles using OpenAI GPT-4o-mini via LangChain, records results in Google Sheets, and sends a curated HTML email digest via Gmail. Integrates HTTP Request, HTML parsing, AI classification, Sheets, and Gmail nodes for sustainable news curation.",https://drive.google.com/file/d/193wypIbU9Vrzz0HW71xwEDRupqkyOH7s/view?usp=sharing
Automated Product Photo Enhancement & Storage,"An n8n workflow that downloads product images from Google Sheets, uses OpenAI GPT models to analyze and create AI-generated professional product photography prompts, edits images with OpenAI's image editing API, then uploads results to Google Drive and updates the sheet. Tech stack: n8n, OpenAI GPT-4 & GPT-4O, OpenAI Image Edit API, Google Sheets, Google Drive.",https://drive.google.com/file/d/1FQMot3FyxbM3kKvJirNfk7kGpT0NOUrc/view?usp=sharing
Google Drive Nested Folder Creator,"Automates the creation of nested folders in Google Drive from a slash-separated path string. Uses Google Drive API via n8n nodes, and JavaScript code nodes to iterate and check folder existence, creating missing folders step-by-step until the full path is built.",https://drive.google.com/file/d/1-49x2hWsvlvwYWyQ0hKxGFgdIdBiWy63/view?usp=sharing
n8n Workflow Backup to Google Drive,"Automates scheduled backups of all n8n workflows to a specified Google Drive folder using n8n API, Google Drive API, Gmail for notifications, and Discord for status alerts. Enables reliable versioned backups and timely notifications on success or failure.",https://drive.google.com/file/d/1KoXQIgkj-iH0cdeIwvUHGLqS_0UxdZbD/view?usp=sharing
Chat Message Batch Consolidator with LangChain,"This n8n workflow buffers chat messages per context using Redis, waits for inactivity or message count thresholds, and uses OpenAI GPT-4.1-nano via LangChain to consolidate messages into a single summary paragraph. Ideal for chat apps needing batch processing and deduplication.",https://drive.google.com/file/d/1r9iLkINhF5AiQw_oFpyKd3Z0j7URmvUL/view?usp=sharing
WhatsApp Campaign Automation with KlickTipp,"Automates personalized WhatsApp outreach using WhatsApp Business Cloud API integrated with KlickTipp for subscriber-triggered campaigns. Features message filtering, template messaging, opt-out management, and dynamic content insertion via n8n workflow.",https://drive.google.com/file/d/1NVTeVmiUDz7PluKFxEbq53nI67ByqkQ7/view?usp=sharing
Secure Webhook with Auth & Payload Check,"An n8n workflow that protects a webhook endpoint by verifying a Bearer token and validating required fields in the JSON POST body. Uses native n8n nodes for webhook, conditional checks, JavaScript code, and structured JSON responses for 200, 400, and 401 HTTP codes.",https://drive.google.com/file/d/1Tvwg34ZSnWr__EDlyk8aY4DKfOZioTn7/view?usp=sharing
Prevent Concurrent Runs with Redis Lock,"n8n workflow to prevent concurrent executions using Redis for distributed locking. It uses Redis keys to track workflow states (set, get, unset) and manages workflow concurrency by erroring if already running. Useful for critical or long-running tasks to avoid overlaps.",https://drive.google.com/file/d/1cDGqmjVa0rMaZnrIk7DMnwD5Bo-AMO2F/view?usp=sharing
Obsidian Notes Automation via Google Drive & OpenAI,"Automates creation/update of Markdown notes in an Obsidian Vault by saving workflow outputs to Google Drive. Uses n8n, Google Drive API, and OpenAI for AI-powered Zettelkasten note generation and YAML frontmatter metadata. Enables real-time, structured knowledge management.",https://drive.google.com/file/d/1xR1epmcLS4ovtFP99htx_ldP0WzAnkBE/view?usp=sharing
Daily Automated Customer Win-Back Offers,"An n8n workflow that daily fetches customer churn risk data from Google Sheets, filters high-risk non-campaign customers, and uses Google Gemini (PaLM) AI to generate personalized win-back offers. It logs activity in Sheets and sends offers via Gmail for customer retention.",https://drive.google.com/file/d/1RKycdnb_vSjhEqw9IrgrB6ykyfIRSb8A/view?usp=sharing
n8n LLM Chaining Workflow with Anthropic,"Automates multi-step content analysis using n8n, Anthropic Claude 3.7 LLM, HTTP scraping, Markdown conversion, and memory management. Processes webpage content via chained and parallel LLM calls for detailed insights and humor generation.",https://drive.google.com/file/d/1En6U4BGC_Wmu7gSslY9WUAtFhprGg2Hb/view?usp=sharing
n8n Workflow Management & Backup Automation,"Automates listing, detailed retrieval, file backup, and metadata updating of n8n workflows using n8n API, Airtable, Dropbox, and Cron. Supports batch processing and triggers; ideal for managing and backing up workflows systematically.",https://drive.google.com/file/d/1mlSlAxCLs9Aw2z1TflfeVY2ed75hc9Kn/view?usp=sharing
OpenAI File Retrieval with Citation Formatter,"Automates citation-rich content retrieval using OpenAI assistant with vector store for file search. Integrates OpenAI API, HTTP requests, and n8n Langchain memory nodes to format text with dynamic citations in Markdown or HTML, enhancing accuracy and traceability.",https://drive.google.com/file/d/1oXkjMn2UNKfjd1uYoOt9VeGReIdBBj67/view?usp=sharing
Google Calendar MCP Server Integration,"An n8n workflow integrating MCP Server with Google Calendar API to manage events via create, read, update, and delete operations. Utilizes Google Calendar OAuth2, n8n MCP Trigger & Client tools, and OpenAI GPT-4o model for AI-driven calendar management workflows.",https://drive.google.com/file/d/19F3bzu2lPizlOD780XKYfyQEUl_Rvfte/view?usp=sharing
Clinic Appointment & Reminder Assistant,"Automates clinic appointment management and reminders using OpenAI GPT-4, Google Calendar, Google Tasks, Telegram, WhatsApp (Evolution API), and Postgres. Handles patient rescheduling, confirmation, shopping lists, and escalations for a streamlined healthcare workflow.",https://drive.google.com/file/d/1c427PTEnY-8Zo2E0g3O9REtDfFxnW-se/view?usp=sharing
Sports Betting Data Automation with TheOddsAPI & Airtable,"Automates daily retrieval and updating of sports betting events and results using TheOddsAPI for data fetching and Airtable for record management. Includes scheduled triggers for morning event pulls and evening score updates, customizable for any sport.",https://drive.google.com/file/d/1jLkrxqg_ZedCWkynCm2xDUILvD4NoApi/view?usp=sharing
Open Source Project Metrics Dashboard,"Automates collection and updating of development metrics from GitHub, Docker Hub, npm, and Product Hunt APIs to a custom dashboard using n8n workflow automation with HTTP Requests, GitHub node, and JavaScript functions.",https://drive.google.com/file/d/1tAUU-fniwslM4BGqJfAXiXbNsCYNveIX/view?usp=sharing
Google Sitemap Index URL Re-indexing,"Automates fetching and parsing sitemap.xml URLs, checks indexing status via Google Indexing API, and updates Google with new or modified URLs for faster re-indexing. Uses HTTP requests, XML parsing, Google OAuth2 API in n8n workflow.",https://drive.google.com/file/d/1-gHgMX-3mLohuX-mARix8Vw-vMhUswPu/view?usp=sharing
Auth0 OAuth2 User Login Workflow,"An n8n workflow that automates user authentication via Auth0 OAuth2. It uses Auth0's OAuth2 API to authorize users, exchange authorization codes for access tokens, and retrieve user info. Includes webhook triggers and HTTP Request nodes for secure login flow.",https://drive.google.com/file/d/1aoSBULAJl4U9ieJZCIZT31Qt7YQK3Awo/view?usp=sharing
AI-powered Gmail Auto-labeler,"Automatically categorizes Gmail messages into labels (Partnership, Inquiry, Notification) using OpenAI's GPT-4 Turbo and n8n automation. Integrates Gmail API for triggers, label management, and message updates. Enhances inbox organization with AI-driven content classification.",https://drive.google.com/file/d/1_AVR5p592jlKOvPYVjSXE98iooc1tJik/view?usp=sharing
PUQ Docker NextCloud Deployment API,"This n8n workflow automates deployment and management of NextCloud instances in Docker for WHMCS/WISECP through an API backend. It uses Docker, docker-compose, SSH, nginx-proxy, and PowerDNS API to manage containers, DNS records, NGINX config, user accounts, and disk mounts.",https://drive.google.com/file/d/1Da76S2v4k6oG2EswEc2E_5Ws4XZGWeg2/view?usp=sharing
OAuth2 Configuration Finder AI,"AI-powered n8n workflow to identify OAuth2 settings (authorization URI, token URI, audience) for APIs from a service name. Uses OpenRouter Chat Model with Llama 3.3, LangChain AI integration, and structured JSON parsing with confidence scoring for reliable API OAuth2 setups.",https://drive.google.com/file/d/1IhJh4rbcYdhXYceHHH9K3enaw5DEsTDA/view?usp=sharing
Form Data to Google Sheets & Airtable Pipeline,"Automates data collection from an n8n form, extracting date/time, formatting inputs, saving to Google Sheets and Airtable, and sending personalized emails via Gmail. Utilizes n8n workflow with Form Trigger, Code node, Google Sheets, Airtable, and Gmail integrations.",https://drive.google.com/file/d/14QAlUboimhoc0ksFg6KjDM_W-lERsJ5H/view?usp=sharing
Spotify Liked Songs to Playlist Sync,"An n8n workflow that automates syncing Spotify Liked Songs to a specified playlist by adding missing tracks and removing unliked ones. Utilizes Spotify API for data fetch and modification and Gotify for notifications. Runs on a scheduled trigger, ideal for music playlist management.",https://drive.google.com/file/d/1rkMgsDbB0l3h65GwkP3kQNiHjlmy8y9F/view?usp=sharing
Google Calendar Event Manager,"An n8n workflow integrating Google Calendar API for creating, reading, updating, deleting, and checking availability of calendar events via automated webhook triggers. Utilizes Google OAuth2 for authentication and Langchain MCP trigger for AI-driven interactions.",https://drive.google.com/file/d/1nnpZ8g3gC8Rft7ZNPAFhbgEP9budLMfm/view?usp=sharing
Landing Page Conversion Rate Optimizer,"Automates analysis of landing pages by scraping URLs, then uses OpenAI's GPT-powered Langchain Agent to roast and provide 10 personalized, creative, and actionable Conversion Rate Optimization recommendations. Ideal for marketers and founders wanting data-driven CRO insights.",https://drive.google.com/file/d/1e_hVl5NNyHv_U9mzvHSzRV-xu0VxPNM1/view?usp=sharing
AI Research Reports via Jina DeepSearch,"Automates deep research using Jina AI DeepSearch API and n8n. Users input queries via chat, triggering the API to generate structured, fact-based reports. Includes automated Markdown formatting and cleanup for readable, insightful analysis. No API key needed.",https://drive.google.com/file/d/1chCCaPwlfiGc0GriSApXPYMbJmnjoBWM/view?usp=sharing
Airtable Multi-Method API Endpoint Template,"An n8n workflow providing a RESTful API for Airtable with full CRUD operations via multi-method webhooks. It uses Airtable API and n8n webhook/respond nodes to create, read (single/all), update, and delete customer records in Airtable.",https://drive.google.com/file/d/17Zkl6lW8ig8-dwhC8E3KXs0bZCw8caGN/view?usp=sharing
Amazon Best Seller Electronics Data Extractor,"Automates extraction of Amazon Electronics best seller data using Bright Data API for scraping and Google Gemini LLM for structured information extraction, delivering product rankings, ratings, and offers as structured JSON.",https://drive.google.com/file/d/1Of7bjD1lQGJkK0tiAZeDGftPP0aXyzrk/view?usp=sharing
HN Who is Hiring Job Scraper,Automates extraction of 'Ask HN: Who is hiring?' posts from Hacker News using Algolia Search API and Hacker News API. Leverages OpenAI GPT-4o-mini to structure job listing data and stores results in Airtable. Ideal for tracking tech job opportunities monthly.,https://drive.google.com/file/d/1T5zuvqcv7YvZGVdJc4gMQCU-AzkwnW27/view?usp=sharing
Hacker News Historical Headline Summarizer,"Automates fetching Hacker News front-page headlines from multiple years on the same day, categorizes and summarizes key tech trends using Google Gemini (PaLM) LLM, and publishes markdown reports via Telegram. Utilizes HTTP requests, HTML parsing, date calculations, and Langchain LLM integration.",https://drive.google.com/file/d/1U6TXbVO-LZ8PehRiRkSaCj1IJcfhsI5O/view?usp=sharing
Line MiniBear Bot: Namecard & Task Automation,"Automates Line messaging by processing texts, images, and audio. Uses Line Messaging API, OpenRouter GPT-4o model, and Microsoft suite (Teams, To Do, OneDrive) to extract namecard info, create tasks, save messages, and manage files with AI-driven content recognition.",https://drive.google.com/file/d/1Gv0qkPkza5oH_eCwQhGzFAH4TMbpatY0/view?usp=sharing
AI Motion Illustration Video Generator,"Generates motion illustration videos by combining Midjourney AI image generation and Kling API video creation. Uses PiAPI with HTTP requests, automating from image prompt to final video output for content creators and social media professionals.",https://drive.google.com/file/d/1aoZ7lZFKmMx9A77oa23Ipclhp0DcdUQA/view?usp=sharing
Paul Graham Essays Vector Search with Milvus,"Automates scraping latest Paul Graham essays, extracts and cleans text, creates embeddings with OpenAI, and stores them in Milvus vector database. Enables querying via chat with AI-powered citation retrieval using OpenAI GPT-4 model and LangChain integration.",https://drive.google.com/file/d/1sU5L_qcH-h6mPbv70MJS8dXWgFLZjV7R/view?usp=sharing
Perplexity Research to TailwindCSS HTML,"An n8n workflow that automates research on a user-provided topic using Perplexity API and OpenAI GPT-4o-mini models, improves the prompt, generates structured article content, and converts it into a single-line, responsive, Tailwind CSS-styled HTML page, optionally sending summaries via Telegram.",https://drive.google.com/file/d/1GgyYWlZjfUAC1UviyWyzvyLM3Ia2NVNB/view?usp=sharing
DeepResearcher: AI-Powered Notion Research,"Automates deep topic research by querying web SERPs, extracting key learnings via OpenAI GPT and Google Gemini, and organizing findings into Notion. Integrates OpenAI and Google Gemini chat models with Notion API for structured expert-level research synthesis.",https://drive.google.com/file/d/1dhu4NEdb0ORsL9gV0WBzdks6uIRXtON6/view?usp=sharing
Notion to Clockify Sync Automation,"Automates synchronization of clients, projects, and tasks between Notion and Clockify using n8n. Employs Notion and Clockify APIs, scheduled triggers, webhooks, and dataset comparisons to ensure data consistency and archive outdated entries.",https://drive.google.com/file/d/1gEY5fNMJeR5TcduxOKZlCCCFbI83WsOU/view?usp=sharing
Indeed Company Info Extract & Summarize,"Automates extraction and summarization of company data from Indeed using Bright Data's Web Unlocker API and Google Gemini LLM. Converts markdown data to text and HTML, formats results via AI agent, and sends summarized insights via webhook for HR and engineering use.",https://drive.google.com/file/d/1jzyi-eA2a0vEAwsVRq_ZPNET21yqZ7rs/view?usp=sharing
Line Bot Chinese Translator,"n8n workflow integrating Line Messaging API and OpenRouter.ai LLM to translate text and image content to Chinese with pinyin and English. Supports text, image input via Line webhook, uses OpenRouter's qwen models, sends replies back via Line API.",https://drive.google.com/file/d/1QvZP_utcQ6evD3wUWoYbGh8nteSx9MJ3/view?usp=sharing
AI Travel Planner with Couchbase & Gemini 2.0,"An AI-powered travel planning assistant using Google Gemini 2.0 Flash for chat, OpenAI text-embedding-3-small for embeddings, and Couchbase vector search for storing and retrieving points of interest. Enables conversational trip planning with vector similarity search.",https://drive.google.com/file/d/1ifwFP6Gih-5xWoBh3Lr3ZTSZEA3U--c-/view?usp=sharing
Entra Contacts to Zammad User Sync,"An n8n workflow to synchronize Microsoft Entra contacts with Zammad user accounts. It uses Microsoft Graph API to fetch contacts and Zammad API to create, update, or deactivate users. Automates user management by merging, filtering, and comparing datasets.",https://drive.google.com/file/d/1e1ziFjRwqgQsEvI3RNpphyIh1woF6Oif/view?usp=sharing
CoinMarketCap DEXScan AI Agent,"n8n workflow integrating CoinMarketCap's DEXScan API with GPT-4o Mini AI to provide real-time and historical data on decentralized exchanges, including liquidity, trading volume, OHLCV, spot pairs, and trades. Uses HTTP requests, OpenAI API, and memory buffers for intelligent query handling.",https://drive.google.com/file/d/17KVIc7HFGsMirPDN14ek5t3jfh6Y9x4x/view?usp=sharing
AI-Powered Resume Review & Google Sheets Logging,"Automates resume submission, extraction, and evaluation using a form, Google Drive, PDF text extraction, OpenAI GPT-4, and Google Sheets for record keeping. It extracts personal info and qualifications, summarizes candidate profiles, assigns HR ratings, and logs results for streamlined hiring.",https://drive.google.com/file/d/1V3tuVB2r0Dark3qYdHTsGEzwl_QHO0Mv/view?usp=sharing
Auto-Create Airtable Tables from Webflow Forms,"Automates creating Airtable tables dynamically for each Webflow form submission using Webflow API trigger and Airtable API (Personal Access Token). Organizes submitted form data efficiently without manual table setup, ideal for Webflow sites needing structured data storage in Airtable.",https://drive.google.com/file/d/15PFuVGm9kffsyz9IiO2-7d8vPjKwWc6Y/view?usp=sharing
Pipedrive OAuth2 Token Refresh Workflow,"Automates OAuth2 token refresh for Pipedrive API using n8n, Supabase DB for token storage, and HTTP/webhook nodes. Enables secure storage and refreshing of access tokens for reliable API calls with Pipedrive integration.",https://drive.google.com/file/d/1cAsh7SDXUkEjMq-Tm85oFAJuXQlQkJJP/view?usp=sharing
SSL Certificate Expiry Alert System,"Automates weekly monitoring of SSL certificates for URLs listed in Google Sheets using SSL-Checker.io API. Updates sheet with validity and expiry info, and sends alerts via Gmail and Telegram for expiring or invalid certificates, ensuring proactive SSL management.",https://drive.google.com/file/d/1AhBqPgsQPcIN6Zs-TEXCNiljbF_e6ZhB/view?usp=sharing
