Name,Description,Link
Clockify to Syncro Time Tracker Sync,"Automates time entry synchronization from Clockify to Syncro MSP using n8n. It captures time tracking data via webhook, matches users, updates or creates timers on Syncro via API, and logs entries in Google Sheets. Tech stack: Clockify API, Syncro MSP API, Google Sheets, n8n workflow automation.",https://drive.google.com/file/d/1Z8CU6UUC5Dbe-pfGmAJKyshiUztfbyBM/view?usp=sharing
NameCheap Dynamic DNS Updater,"Automates updating DNS records on NameCheap via their Dynamic DNS API. Uses n8n workflow with Cron for scheduling, IP check to avoid redundant updates, and HTTP Request nodes for API calls. Ideal for users managing dynamic IPs on multiple subdomains.",https://drive.google.com/file/d/14aRgHej2nKRTwU45x1hQcwUegNjCJXW7/view?usp=sharing
TheHive & SIGNL4 Alert Automation,"An automated security alert system using TheHive API for incident management and SIGNL4 for alert notifications and resolution. It includes webhook triggers, conditional checks, and supports efficient security operations automation.",https://drive.google.com/file/d/1Pq5UNylqKzG_gzM7ePmgLi6AEyYcSxPd/view?usp=sharing
Crosspost Articles to Medium & Dev.to,Automates posting of articles received via webhook to Medium (using Medium API) and Dev.to (using their REST API). Uses n8n webhook node for data intake and formats posts in Markdown for seamless cross-platform publishing.,https://drive.google.com/file/d/1HS7G0DRXHx2St88tjMRhOsF19AGas2dc/view?usp=sharing
Google Webpage Entity Extraction,"Extract named entities from any webpage by sending its URL to a webhook that fetches content and uses Google Natural Language API. Tech stack: n8n, HTTP Request, Google Cloud Natural Language API. Returns structured entity data like people, locations, orgs with salience.",https://drive.google.com/file/d/13ED3dX6tOOLJy_XiWaFH-mnXWd0MnAOp/view?usp=sharing
Zammad Support Tickets Summary,"Automates daily retrieval and categorization of Zammad support tickets using Zammad API, filtering by status, and sends a summary notification to Zulip chat for customer support teams, scheduled via cron for standup meetings.",https://drive.google.com/file/d/1lgPP1QjHcj2wgpCKqGzJChQy31jsg9Jj/view?usp=sharing
CFP Submission Selection & Visualization,"An n8n workflow integrating Airtable, Bannerbear, and Trello to automate selection and visualization of conference talks scoring above 15. It pulls submissions from Airtable, creates custom banners via Bannerbear API, and organizes selected proposals on Trello boards.",https://drive.google.com/file/d/139jpH2B7yzl2wKWWmspQfhqsPBRegwV9/view?usp=sharing
Automated Receipt Expense Tracker,"An n8n workflow that automates expense tracking by capturing receipt images via Typeform, extracting details with Mindee's OCR API, and storing expenses in Airtable for easy management and review.",https://drive.google.com/file/d/19DUZKknYfmb87L93ANxcfnSUt1B4TA3y/view?usp=sharing
Workflow Failure SMS Alert via Twilio,"This n8n workflow uses an Error Trigger node and Twilio API integration to send an SMS notification when any workflow fails. It helps monitor workflow executions by alerting users immediately via SMS, ensuring quick response to failures.",https://drive.google.com/file/d/1D2jQR-p19akJeosIuxuHPQsODhVPdn94/view?usp=sharing
Figma to Jira Auto Version Commenter,Automates updating Jira issues with design version info from Figma using n8n. Integrates Figma webhook (file version updates) and Jira Cloud API to find issues and add version comments. Requires Figma Commit Plugin and Jira credentials configured.,https://drive.google.com/file/d/1HQOB1TrfhXS4ozP_DJ2_vhrGMbNznG55/view?usp=sharing
Perplexity AI Research Assistant,"An n8n workflow integrating Perplexity AI's Sonar model via HTTP API to answer research queries. It formats user prompts, sends them to Perplexity AI, and extracts clean, in-depth responses for knowledge discovery and content research automation.",https://drive.google.com/file/d/1_3FuDYjw_6lDCRG7yJsmrK5oEercIhAF/view?usp=sharing
Google Sheets to Mautic Contact Sync,Automates syncing contacts from Google Sheets to Mautic CRM every 5 minutes using Google Sheets API and Mautic API via n8n workflow.,https://drive.google.com/file/d/13E8i2nv5k1HrvOLygqVrKLm9ATOrxk2L/view?usp=sharing
Product Feedback Collector & Manager,"Automates collecting product feedback via Typeform, stores responses in Airtable, and routes low-score feedback to Trello for team review. Integrates Typeform API, Airtable API, and Trello API to streamline feedback management and prioritize action items efficiently.",https://drive.google.com/file/d/1y5w80UQsNPKP_ijp6WikynJpT3kP6dkt/view?usp=sharing
IoT Sensor Data Logger via MQTT & InfluxDB,"An n8n workflow that uses MQTT to receive temperature and humidity data from a remote ESP32 with DHT22 sensor, processes the data with JavaScript, and stores it into an InfluxDB time-series database via HTTP API. Ideal for IoT sensor monitoring.",https://drive.google.com/file/d/1N_-Yqi3BGX26UBdGlCeSN4w2AstRzFad/view?usp=sharing
OpenAI Text-to-Speech Workflow,"An n8n workflow that converts text to speech using OpenAI's TTS API. It accepts text and voice parameters, sends an authenticated HTTP POST request to the OpenAI audio/speech endpoint, and outputs an .mp3 audio file. Designed for easy manual or automated triggering.",https://drive.google.com/file/d/1GDUwYBW2kWLqy4IHVps-WLekcxuTwa_h/view?usp=sharing
Weather Info Fetcher via Webhook,"An n8n workflow that fetches current weather data for a specified city using OpenWeatherMap API triggered by a webhook. It extracts temperature, humidity, wind speed, description, and city info, delivering structured weather details. Built with n8n, OpenWeatherMap API.",https://drive.google.com/file/d/1K1QpEmV8gasQOZu-Uc3qFk0zwaB1_M0W/view?usp=sharing
Weather SMS Notification via Webhook & Airtable,"n8n workflow receives POST webhook with user data, stores it in Airtable, fetches current weather via OpenWeatherMap API for the specified city, then sends weather details by SMS using Twilio. Integrates Webhook, Airtable, OpenWeatherMap, and Twilio APIs.",https://drive.google.com/file/d/159KR2czJsyjPv01XqIQi0PVDTAF8161-/view?usp=sharing
Receipt OCR to Airtable Logger,"Automates receipt data extraction using Mindee OCR API from uploaded receipts via webhook, then logs categorized expense details like merchant, date, total, and currency into Airtable. Uses n8n webhook, Mindee OCR, and Airtable API for expense tracking automation.",https://drive.google.com/file/d/1E3-p7dE_KtN5stHSeKnaVRDfeLR3HLtA/view?usp=sharing
Receipt Data Extraction via Mindee API,"Automates extracting detailed information from receipt images using Mindee OCR API. Retrieves an image via HTTP request, then extracts structured data like totals, dates, and vendor info. Useful for expense tracking and accounting automation.",https://drive.google.com/file/d/1OAYfpHGugTie2KFoHArgBlSIn3hS7wJt/view?usp=sharing
Weekly Coffee Group Bot for Mattermost,"Automates weekly virtual coffee meetups by grouping Mattermost users into random teams of 3 and sending invites via Google Calendar. Utilizes Mattermost API, Google Calendar API, cron scheduling, and JavaScript for dynamic group creation to foster team bonding.",https://drive.google.com/file/d/1GFmgPBg4sUFhavQf7WJvHgPKncokzRl2/view?usp=sharing
Daily Language Learning with Hacker News,"Automates daily extraction of top 3 Hacker News article titles, extracts and translates unique words to German using LingvaNex API, stores results in Airtable, and sends a curated vocabulary list via SMS with Vonage API.",https://drive.google.com/file/d/1PXydV9kFQrTSXaGQRIjYPmXFtudhBivo/view?usp=sharing
Google Sheets to Orbit Member Sync,Sync and upsert member and activity data from Google Sheets to Orbit workspace using Google Sheets API and Orbit API integration in n8n. Automates community metrics management with OAuth2 authentication and data merging by GitHub usernames.,https://drive.google.com/file/d/1mJyL3TMuH50t9Sg06q4R563CduhJX37N/view?usp=sharing
Automizy Contact List Management,"This n8n workflow uses Automizy's API to create a contact list, add a new contact, update contact tags, and retrieve all contacts in the list. It automates email marketing contact management seamlessly.",https://drive.google.com/file/d/10JqcxnrbfqigWsGoBB34CkcYN_n8oONU/view?usp=sharing
Daily Weather Push Notifications via Pushcut,Automates sending daily 9AM weather updates for Berlin using OpenWeatherMap API and Pushcut push notifications in n8n. Ideal for timely personalized weather alerts leveraging cron scheduling and No-Code automation.,https://drive.google.com/file/d/15WlRx6207fHS5cRZV3FfwKzkTtVt7TBu/view?usp=sharing
Matrix Room Creation & Invitation Workflow,"Automates creating a Matrix chat room, inviting members from another room, and sending a welcome message. Utilizes Matrix API for room and user management, with conditional logic to avoid re-inviting the creator, enabling seamless community onboarding.",https://drive.google.com/file/d/1FW0k0pBPg0GnwCFJNgsjiVTVNuy9YQAc/view?usp=sharing
Daily Weather SMS via Vonage,Automates sending daily weather updates for Berlin at 9 AM using OpenWeatherMap API and Vonage SMS service via n8n workflow with Cron scheduling.,https://drive.google.com/file/d/1RbAZMhl2K0oVweMBTc3MVcEwwcmJuAK7/view?usp=sharing
Google Sheets to Mattermost Alert,"Automates monitoring of a Google Sheet using OAuth2, checks for new entries every 45 minutes, and sends real-time Mattermost notifications with new data details. Utilizes n8n workflow nodes: Google Sheets API, custom JavaScript function, interval trigger, and Mattermost API.",https://drive.google.com/file/d/1nof7-I9C2K7qkhU947ZudoQko_dLg6sb/view?usp=sharing
AI-Powered Google Calendar MCP Server,"This n8n workflow integrates OpenAI's GPT-4o model with Google Calendar API to build an AI assistant managing calendar events via MCP server-client tools. It supports creating, updating, deleting, and searching events, plus additional AI utilities like text case conversion, joke retrieval, and random user data generation.",https://drive.google.com/file/d/1hwahtQIW1ca508wYDDy6JJPPBa59nWPM/view?usp=sharing
Daily Weather Push Notification,"Automates daily weather updates for Berlin via OpenWeatherMap API, sending temperatures as push notifications using Pushover. Triggered by a Cron job running at 9 AM. Ideal for users wanting timely, automatic local weather alerts on their devices.",https://drive.google.com/file/d/1Q0NyAT_43sbTn5jNqi9TeMPVBCWqdoex/view?usp=sharing
GetResponse to Airtable Subscriber Logger,Automates capturing new GetResponse email subscribers via webhook and appends their name and email to an Airtable base. Uses GetResponse API webhook triggers and Airtable API integration to streamline email list management.,https://drive.google.com/file/d/1qV-rG30wFGpgKbAJg564DprXyKYEp2iX/view?usp=sharing
QuickBooks Invoice Automation Workflow,"Automates customer creation, invoice generation, and email sending in QuickBooks using OAuth2 API integration within n8n workflow. Streamlines accounting tasks by chaining customer creation, invoice creation, and invoice emailing efficiently.",https://drive.google.com/file/d/1jSNF0H_AhpEnKUrjSxu3783e8MCdseXZ/view?usp=sharing
MailerLite Subscriber Management Workflow,"n8n workflow integrates with MailerLite API to create, update, and retrieve email subscribers. It automates managing subscriber data including custom fields like city using MailerLite nodes triggered manually. Ideal for email marketing automation.",https://drive.google.com/file/d/1mAUk3gBV9ikz98cdzBe42h7uT4gWCM-t/view?usp=sharing
Weather Info via Webhook API,"An n8n workflow that provides current weather data via a webhook. Utilizes OpenWeatherMap API to fetch temperature and 'feels like' info based on city query parameters, returning formatted weather details in English.",https://drive.google.com/file/d/1Gtf_XEiuf5zSx3dslQwiPs3SV3XFNoUH/view?usp=sharing
Typeform to PDF Invoice Automation,Automates invoice generation by triggering on Typeform submissions and using APITemplate.io to create customized PDF invoices. Utilizes Typeform API for form data capture and APITemplate.io API for dynamic PDF creation and download.,https://drive.google.com/file/d/1GbpN1W3cKtqixmnq1mH1Pa-cb5dfhr9a/view?usp=sharing
Wise Transfer Event to Airtable Logger,"Automates logging of Wise money transfer events into Airtable by triggering on transfer state changes using Wise API, then fetching transfer details and appending structured data (ID, date, reference, amount) to Airtable. Integrates Wise API and Airtable with n8n workflow.",https://drive.google.com/file/d/1cXSpGYGRBlfqMnQjD4NDm3ZKTY4l7oer/view?usp=sharing
Google Trends Data Extract & Summarize,"Automates extraction of Google Trends data using Bright Data proxy and web unlocker, followed by structured data extraction and summarization via Google Gemini AI (PaLM). Outputs summaries via email and webhook, enabling insightful trend analysis.",https://drive.google.com/file/d/1lpY0YxAtuhzzrbhUsNK9vSpcsWU2_6DG/view?usp=sharing
Typeform Feedback Sentiment & Task Automator,"Automates processing of Typeform feedback by analyzing sentiment with Google Cloud NLP. Positive feedback triggers entries to Notion and Trello, and notifications sent via Slack. Integrates Typeform, Google Cloud Natural Language API, Notion, Trello, and Slack for streamlined feedback management.",https://drive.google.com/file/d/1Wri6GJsw78jo2mWZQCtyG9HEaaVcyYHD/view?usp=sharing
Amazon Ads AI Optimization Workflow,"Automate Amazon Ads report processing with Google Drive, Excel/CSV data extraction, and GPT-4o AI analysis to generate actionable optimization recommendations. Uses n8n nodes, Google Drive API, OpenAI GPT-4o, and Gmail to email insights for bid, budget, and keyword strategies.",https://drive.google.com/file/d/1ZHjcBhIA4w_7WNN8GEJN2QgTA1K1kkIV/view?usp=sharing
Airtable AI Assistant Workflow,"An n8n workflow integrating OpenAI GPT-4o-mini and Airtable API to process user chat requests, query Airtable bases and tables, and perform data aggregation and visualization. Enables dynamic, AI-driven interactions for managing Airtable data.",https://drive.google.com/file/d/1Ti55wf7JZkj0eBQgoMJW68wGMHPn89Rb/view?usp=sharing
AI-Powered HR CV Processing & Evaluation,"Automates job application processing: candidates submit CVs via a form, PDFs are extracted, AI extracts qualifications and personal data using LangChain and OpenAI GPT-4o-mini, evaluates fit against a company profile, and logs results to Google Sheets. Integrates Google Drive and Sheets APIs.",https://drive.google.com/file/d/1lkMsUKDGBkRV1cJRnnMHf76vxHUa56jv/view?usp=sharing
AI Agent with Hacker News Data Fetcher,"An n8n workflow integrating LangChain AI agent with OpenAI chat and Hacker News API to fetch and process top posts data. Enables querying Hacker News popular posts through AI chat, combining AI and real-time data fetch for interactive insights.",https://drive.google.com/file/d/1oSiiId-QTJc-J8yeOW28BUVq77OplmjM/view?usp=sharing
Stock Market Q&A AI Workflow,"An n8n workflow leveraging OpenAI embeddings, Qdrant vector store, and Google Drive PDFs to enable Q&A over stock market documents. It extracts data via Google Drive, processes with OpenAI and LangChain, and answers queries through a webhook API.",https://drive.google.com/file/d/13iNtw61g1jkAeszOYWsk9Xy0b3YpRELs/view?usp=sharing
Customer Feedback Sentiment Analysis,"Automates sentiment classification of customer feedback using an OpenAI API with form input, then logs categorized responses into Google Sheets for easy tracking and analysis.",https://drive.google.com/file/d/1HAb4zFU2lbEBSEBtbervM81s5wijsw0P/view?usp=sharing
AI Data Extraction for Baserow PDFs,"Automates extraction of data from PDFs uploaded to Baserow tables using dynamic user-defined prompts and OpenAI's LLM API. It integrates Baserow webhook events, Baserow API, PDF extraction, and LangChain LLM nodes within n8n to auto-fill table fields based on PDF content and field descriptions.",https://drive.google.com/file/d/1ayxt_T6BU_H3JH_kgDZlgD5cLM2rGHdG/view?usp=sharing
Stock Earnings Report RAG Analysis Workflow,"Automates financial analysis of Google's last 3 quarters earnings by loading PDFs from Google Drive, creating embeddings via Google Gemini, storing/retrieving with Pinecone vector DB, and generating detailed markdown reports saved to Google Docs using AI agents.",https://drive.google.com/file/d/1zgcnw8UYC12vUgDXNADM0EcAGqEuSb-v/view?usp=sharing
Podcast Transcript Summarizer & Digest Generator,"Automates summarization of podcast transcripts using n8n with LangChain, OpenAI GPT-3.5 & GPT-4, and Wikipedia API. Extracts key topics, generates questions, researches explanations, formats as HTML, and emails a comprehensive episode digest.",https://drive.google.com/file/d/1_LVQnk7TClyCkEWCNjDrn1iOt4J1f1Ja/view?usp=sharing
Automated RSS News Aggregator & Trello Notifier,"n8n workflow aggregating news from multiple RSS feeds, filtering recent articles, formatting them in Markdown, and posting summaries as Trello card comments with email notifications. Integrates RSS, Trello API, and Gmail via OAuth2 for streamlined team updates.",https://drive.google.com/file/d/1fFvRaiyQ7mHur_Zj81m4pNvtSs70xxR0/view?usp=sharing
OpenAI Travel Assistant with Google Drive Docs,"Builds a custom OpenAI-powered travel assistant integrated with Google Drive to upload and convert travel agency documents to PDF, updating assistant knowledge. Uses OpenAI GPT-4o-mini, Langchain memory buffer, and Google Drive API for contextual chat interaction.",https://drive.google.com/file/d/1C2Kfx1dqjMZzG214GInXHRH61bLuA5T9/view?usp=sharing
Hugging Face Paper Auto-Import to Notion,"Automates daily extraction of research papers from Hugging Face, uses HTML scraping, OpenAI GPT-4O for abstract analysis, and stores enriched metadata in Notion. Integrates Hugging Face API, OpenAI API, and Notion API for academic paper management.",https://drive.google.com/file/d/1PWQpbGvGWsUIv_AObmB0ddzMEWUaL5U_/view?usp=sharing
Typeform Feedback Sentiment to Mattermost,"Automates sentiment analysis of event feedback submitted via Typeform using Google Cloud Natural Language API, then sends a sentiment score and message to a Mattermost channel. Integrates Typeform, Google NLP, and Mattermost for real-time feedback monitoring.",https://drive.google.com/file/d/1ZS4Hl2tlA7GnKOVOzUJEbr-vzVN0ZwSV/view?usp=sharing
Bing Copilot Search Results Summarizer,Automates extraction and summarization of Bing Copilot search results using Bright Data API for data scraping and Google Gemini AI for natural language processing and structured data formatting. Delivers structured JSON data and concise summaries via webhooks.,https://drive.google.com/file/d/1yOZQPiFhA9K1fLgKIsP5sr_gjZ9sfe-d/view?usp=sharing
Automated Company Review & News Insights,"An n8n workflow integrating OpenAI GPT-4, SerpApi, and Notion API to automate gathering and analyzing company reviews, news, and product offerings. It scrapes review sites, summarizes pros/cons, tracks sentiment, and updates Notion for competitive analysis.",https://drive.google.com/file/d/1elryvvE7wqfl7Hxgp_TiogmBWsjvFfQV/view?usp=sharing
AI Passport Photo Validator,"n8n workflow that imports portrait photos from Google Drive, resizes images, and uses Google Gemini AI vision model to validate passport photo compliance against UK government criteria. Includes structured output parsing for automation.",https://drive.google.com/file/d/18vdO12jc0S6n8C6owFi74aJw2Uc2zBrA/view?usp=sharing
OpenAI Fine-Tuning Workflow with Google Drive,"Automates fine-tuning of OpenAI GPT models using training data stored on Google Drive. Uses n8n with Google Drive API to download a .jsonl training file, uploads it to OpenAI for fine-tuning, and triggers a custom fine-tuned GPT-4o-mini chat model via Langchain integration for interactive AI responses.",https://drive.google.com/file/d/10qySg4-lMs8ZeiOw-rbW0ovX36OFTbQj/view?usp=sharing
n8n Workflow Deployment Automation,"Automates deployment of n8n workflows by monitoring a Google Drive folder for JSON workflow files. Uses Google Drive API, n8n API with authenticated requests to create workflows, apply tags, and move files between Drive folders, streamlining workflow management.",https://drive.google.com/file/d/1Cb4Eg7A4z5gb7h8ce-IMG8HMdSaka9aW/view?usp=sharing
Line Pay Slip Text Extractor with Gemini AI,"An n8n workflow integrating LINE Messaging API, Google Gemini AI, and Google Sheets to extract and classify text from pay slip images or text messages. It auto-analyzes images with Gemini 2.0, parses key payment details, replies via LINE, and logs data into Google Sheets.",https://drive.google.com/file/d/1DsrLgDWtndWx0Vy0vCjiN-lVLC10ZfPK/view?usp=sharing
OpenSea NFT Marketplace Agent,"AI-powered n8n workflow integrating OpenAI GPT-4o Mini with OpenSea API to fetch and analyze NFT listings, offers, orders, and trait-specific data. Enables informed NFT trading decisions with features like best offers, listings by collection, and detailed order lookups.",https://drive.google.com/file/d/1PO9iFnWexq8BqR7FmN77hNPCfnYF6lMX/view?usp=sharing
Texas Tax Code AI Assistant,"An automated workflow using n8n that downloads Texas tax code PDFs, extracts sections, generates Mistral.ai embeddings, stores them in Qdrant vectorstore, and provides a chatbot powered by OpenAI to answer tax-related questions with precise citations.",https://drive.google.com/file/d/1GxF7CpCAKUGtG1BF-ZJEgOFr1sfmQkfF/view?usp=sharing
OpenAI Travel Assistant with Google Drive Docs,"Automates building and updating a GPT-4-powered travel assistant using OpenAI API and Google Drive integration. It downloads travel documents, converts them to PDF, uploads to OpenAI, and enables interactive chat with context memory. Ideal for travel agencies seeking AI support.",https://drive.google.com/file/d/1pAa_8U6rfe5sG1zYRH3pWeWj6KxTsyBL/view?usp=sharing
AI Agent for Interactive Google Sheets Chat,"An n8n workflow integrating OpenAI GPT-3.5-turbo with Google Sheets via API, enabling users to query spreadsheet data conversationally. It includes custom tools to list columns, fetch rows, and get column values dynamically, making complex sheet data accessible through natural language.",https://drive.google.com/file/d/1FoHBrszm6KXpJctJlDA8PDnmnMnl1ZVy/view?usp=sharing
AI-Powered Chat with PostgreSQL DB,"This n8n workflow enables interactive chat with a PostgreSQL database using OpenAI's GPT-4o-mini model and LangChain agent. It automatically generates and executes SQL queries based on user prompts, fetching schema and table info dynamically for accurate DB responses.",https://drive.google.com/file/d/1JhMIpLm3xDV4Imqm6b-zbxu4-slIIAth/view?usp=sharing
GitLab Merge Request AI Reviewer,"Automates code review for GitLab merge requests using GitLab API and OpenAI's LLM. It fetches code changes, parses diffs, and posts detailed, scored review comments directly to merge request discussions, streamlining code quality checks.",https://drive.google.com/file/d/1Pjd9gCowR1gEnWJIXxbaU0XgC2xBgdBR/view?usp=sharing
Yelp Review Extractor & Summarizer with LLM,"Automates extraction of Yelp business reviews using Bright Data API and processes data with Google Gemini LLM for structured analysis and summarization. Integrates web scraping, AI parsing, and webhook notifications for streamlined review insights.",https://drive.google.com/file/d/1NJCVpfAxpuoSUCwVfdRIVBBGbe09Z2MA/view?usp=sharing
Linear Bug Ticket Auto-Classifier,"Automates classification of bug tickets in Linear using OpenAI GPT-4. It filters issues that need triage, classifies bugs by team responsibility (customizable), updates Linear tickets, and notifies Slack if classification fails. Tech: Linear API, OpenAI GPT-4, Slack API, n8n automation.",https://drive.google.com/file/d/1ESX7Ww0PdHMaUsHn_6qvLXxNC4UpnVSk/view?usp=sharing
OpenAI Text-to-Speech Workflow,"An n8n workflow that converts text to speech using OpenAI's TTS API. It sets input text and voice, then sends a request to OpenAI's API to produce an MP3 audio output. Ideal for automating TTS tasks with OpenAI's tts-1 model.",https://drive.google.com/file/d/1p8qwoxkSdztt6wmfuHG_DmxnXsC9TpDl/view?usp=sharing
Weekly Google Analytics Report Automation,"Automates weekly Google Analytics data retrieval (last 7 days & same period previous year), AI-generated summary & analysis (OpenAI GPT-4O), and report delivery via email (SMTP) and Telegram. Scheduled every Monday at 7 AM for actionable insights.",https://drive.google.com/file/d/1DE-H8NCgQb3X1vnBg4ESY9U729tL5YnL/view?usp=sharing
Squarespace Orders to Google Sheets Sync,"Automates retrieval of all Squarespace orders using Squarespace Commerce API and logs detailed order info into a Google Sheets spreadsheet via Google Sheets API. Supports filtering, pagination, and updates with an easy editable global config node.",https://drive.google.com/file/d/1nsRUr7W0Xc3KUFiDJCG16PmpRYby36I8/view?usp=sharing
LangChain n8n Workflow with OpenAI & Wikipedia,"This n8n workflow integrates LangChain with OpenAI language models and a custom Wikipedia tool. It demonstrates creating LLM chains, chat interactions, and agent-based queries combining LLM and external knowledge via LangChain tools for flexible AI responses.",https://drive.google.com/file/d/1NTcIhDpXf4r3hXaEalZmUg3XEU-jGWCT/view?usp=sharing
AI Resume Screening with Multimodal LLM,"Automates candidate resume evaluation by converting PDF resumes from Google Drive into images via Stirling PDF API, then analyzing them using Google's Gemini multimodal language model to determine candidate fit for a role and detect AI bypass attempts.",https://drive.google.com/file/d/17oOLJLGtKJ-YRy4-uRZgtdl4psgn5Pgt/view?usp=sharing
