Name,Description,Link
,,
AI-Powered Automated Research Report Generator,"This n8n workflow automates research report creation using OpenAI GPT-4 for query refinement and summarization, Wikipedia, NewsAPI, Google Custom Search, SerpApi for scholarly papers, and integrates PDFShift for PDF generation. Reports are sent via Gmail and Telegram, streamlining professional research delivery.",https://drive.google.com/file/d/1Tbj8qW3QjSTs4600vpG8_hbiKewjVJN1/view?usp=sharing
AI Social Video Generator & Auto Social Posting,"An automated n8n workflow leveraging Telegram, GPT-4, Kling AI video API, Cloudinary, and Blotato to create AI videos with voice-over and captions, then auto-publish to Instagram, YouTube, TikTok, Facebook, Twitter (X), LinkedIn, Threads, Bluesky, and Pinterest.",https://drive.google.com/file/d/1xPvJlP7zJV1yFvJUzzFndG6UejQgiADn/view?usp=sharing
n8n AI & App Node Reference Library,"Comprehensive n8n workflow showcasing various AI nodes (OpenAI, Langchain agents, Anthropic, Google Gemini) and app integrations (Google Suite, Dropbox, Bitly, Reddit, YouTube, etc.) designed as a visual reference for automation and AI-enhanced workflow building.",https://drive.google.com/file/d/1yaYJvQs6rYrRE6wYgfFbX02H5KKJY2hP/view?usp=sharing
AI Social Video Auto-Creation & Multi-Platform Posting,"Automates video creation from Telegram prompts or images using AI (GPT-4, Piapi, Blotato), merges voice-over and captions, saves metadata to Google Sheets, and auto-publishes videos to 9 social platforms (Instagram, YouTube, TikTok, Facebook, Threads, Twitter, LinkedIn, Bluesky, Pinterest) via Blotato API.",https://drive.google.com/file/d/1GVv54w7jDRv9IlO-1yPK8WfCMFbLRUOJ/view?usp=sharing
AI-Driven Sales Meeting Follow-Up Scheduler,"An n8n workflow automating sales follow-ups using Google Calendar and Gmail APIs. It retrieves past meetings, checks email interaction, uses OpenAI GPT-4 powered AI agents to suggest and book next meeting slots, with human approval for final booking. Supports calendar management and contextualized follow-ups.",https://drive.google.com/file/d/164EuiI1tHQHI7QEKV2GW_R_hZIXLtZsG/view?usp=sharing
Google Calendar to Outlook Sync,"Automates syncing Google Calendar events to Microsoft Outlook. Uses Google Calendar triggers for event creation/cancellation and Outlook API to create/delete events, including email notifications on cancellations. Integrates Google Calendar and Microsoft Outlook APIs via n8n.",https://drive.google.com/file/d/1hRzdeHlnEt_2G8VzAnD-Oa3q-awyfplm/view?usp=sharing
AI Conversational Agent with External Tools,"An AI chatbot workflow using OpenAI's GPT-4o-mini, integrated with SerpAPI and Wikipedia for enhanced real-time info retrieval. It stores recent chat history in a 20-message buffer to maintain context, enabling dynamic, informed human-like conversations.",https://drive.google.com/file/d/1P5kAj3putaCSQxRif8fm--a20CRnoVIh/view?usp=sharing
RAG AI Agent with Milvus & Cohere,"Automates Retrieval-Augmented Generation (RAG) using Cohere embeddings, Milvus vector DB, OpenAI GPT-4o, and Google Drive. Upload PDFs to Drive, auto-embed and store in Milvus, then query via an AI chat agent for contextual AI responses.",https://drive.google.com/file/d/1X4Oxa7AjZ9w74syLBMuGnaiEbBu2M-co/view?usp=sharing
"Incident Management: PagerDuty, Jira & Mattermost","Automates incident lifecycle by integrating PagerDuty, Jira, and Mattermost. Creates Jira issues from PagerDuty incidents, updates statuses on acknowledgment & resolution, and posts real-time messages with interactive buttons in Mattermost channels.",https://drive.google.com/file/d/1gRLDCXYi6fZCRq1B5T5e4YlxpxKU0Wn4/view?usp=sharing
Two-Way Sync Between Pipedrive and MySQL,"Automates bidirectional data synchronization between Pipedrive CRM and a MySQL database. Utilizes n8n nodes including Pipedrive API, MySQL integration, dataset comparison, and conditional logic to create, update, and maintain consistent contact records.",https://drive.google.com/file/d/1GoH-XA-rv_f5m3WZx6VnSL4zUS9HfGgG/view?usp=sharing
Event Attendee Automation with Mattermost & Google,"Automates attendee registration for events using Typeform, Google Sheets, Mattermost chat, Google Calendar, and Gmail. It registers attendees, creates Mattermost accounts, adds them to teams/channels, updates event calendars, and sends confirmation emails.",https://drive.google.com/file/d/1zfAhkW8nERFtBuE4hTNfkdUatp_pgTVS/view?usp=sharing
Phishing URL Analyzer with URLScan and VirusTotal,"Automates phishing URL detection from unread Outlook emails by extracting URLs, scanning via URLScan.io and VirusTotal APIs, and sending detailed Slack alerts. Integrates Microsoft Outlook, Python ioc-finder lib, URLScan.io, VirusTotal, and Slack for automated cybersecurity threat analysis.",https://drive.google.com/file/d/1wg8TcCAu4UVVcObeNz_Vj-LbkWGftmNd/view?usp=sharing
AI Meeting Summary & Follow-Up Scheduler,"Automates extraction of Google Meet transcripts, uses OpenAI-powered AI agent to summarize meetings, identify key points, and schedule follow-up Google Calendar events with attendees. Integrates Google Calendar, Google Drive, Google Meet APIs, and OpenAI Langchain AI agent.",https://drive.google.com/file/d/14_2w10228_E88UsXYVrMUZjnZCaK5K5a/view?usp=sharing
AI-Powered Calendar Assistant with PDF Q&A,"An n8n workflow integrating OpenAI GPT-4o, Pinecone vector store, Google Calendar API, and Langchain to automate appointment booking with Max Tkacz, classify emails, and enable chat-based Q&A on PDFs like the BTC whitepaper, all via a chat interface and Slack notifications.",https://drive.google.com/file/d/142s0F0XpW4vmi7o4Vcx0uKD72ugfrr30/view?usp=sharing
AI Meeting Task & Scheduling Assistant,"Automates meeting transcript processing from Fireflies using OpenAI GPT-4 to create Airtable tasks, notify clients via Gmail, and schedule follow-up calls in Google Calendar. Streamlines project management by converting meeting notes into actionable workflows.",https://drive.google.com/file/d/16QYS3cGF_03pIVVDjnF2Owg_xg2ZiqyS/view?usp=sharing
AI Real-Time Meeting Transcription & Notes,"Automates real-time meeting transcription and note-taking using Recall.ai for transcription, OpenAI GPT-4 for AI insights, and Supabase/Postgres for data storage. Captures, structures, and analyzes meeting dialogue for productivity boosts.",https://drive.google.com/file/d/1FJdwydxPdoE6lV9g8qHRcvJVHhWKCKf4/view?usp=sharing
AI Google Calendar Assistant with OpenAI,"n8n workflow integrating OpenAI GPT-4o and Google Calendar API to create and retrieve calendar events. It uses Langchain for AI agent management, supports natural language chat input, and dynamic memory buffer for session context.",https://drive.google.com/file/d/1nhmSYld-h6hdwQi9Fz3oENSSbUGVsQ6M/view?usp=sharing
Airtable PDF Data Extractor with LLM Automation,"Automates extraction of data from PDFs stored in Airtable using dynamic prompts and OpenAI LLM. Utilizes Airtable webhooks, PDF extraction, LangChain LLM nodes, and HTTP requests for real-time AI-based field updates in Airtable records.",https://drive.google.com/file/d/1zKP4F5Y7ivRN069ZTJNINxHCEb4q1GrZ/view?usp=sharing
AI Triathlon Coach with Strava & Gemini,"Automates personalized triathlon coaching by analyzing Strava activity data using Google Gemini (PaLM) AI. Generates detailed, motivational feedback and improvement plans for swimming, cycling, and running, then formats and sends insights via email or WhatsApp.",https://drive.google.com/file/d/1tMfGQDFir39_OacM7QmWy4gUUJMNBslI/view?usp=sharing
AI Company Research & Data Enrichment,"Automates company info research using n8n with OpenAI GPT-4, SerpAPI, ScrapingBee, and Google Sheets. Extracts data like domain, LinkedIn URL, pricing, plans, APIs, integrations, and case studies for B2B/B2C markets, enabling scalable enrichment workflows.",https://drive.google.com/file/d/1fVRa8HCwSZ8uFgnG-IEAbr_V_X4WWs9q/view?usp=sharing
AI-Powered ERPNext Recruitment Automation,"Automates candidate screening and job application processing by integrating ERPNext ERP, Google Gemini AI, and communication tools like WhatsApp and Outlook. Extracts resume text, evaluates fit via AI scoring, updates ERPNext with decisions, and notifies applicants.",https://drive.google.com/file/d/1yKxWwn1Mp-CHPn19nnyCyPU38fbvVslA/view?usp=sharing
Google Sheets to Google Calendar Event Automation,"Automates creation of Google Calendar events from new rows in Google Sheets using n8n. Integrates Google Sheets API for event data retrieval and Google Calendar API for event creation, including date formatting, event details, and color-coding for efficient event management.",https://drive.google.com/file/d/14WTp9E15-8oGMzG1Fvqg7HgOvttVR0Oy/view?usp=sharing
Automated Blog Writer & Publisher,"An n8n workflow automating blog content creation and publishing. Uses Google Sheets for scheduling/configuration, OpenAI (via OpenRouter) for AI content generation, and WordPress XML-RPC API for posting. Includes data preprocessing, content merging, and status logging to Sheets.",https://drive.google.com/file/d/11doZuPD0ne3gmOVOxuQSN24LmIYrj2YR/view?usp=sharing
AI-Powered Interview Scheduling Assistant,"An automated interview scheduler using OpenAI GPT-4o-mini and Google Calendar APIs. It checks calendar availability, generates 30-min weekday slots (9am-5pm EST), interacts via AI chat to gather candidate info, and books interviews without double booking.",https://drive.google.com/file/d/1IatlCrRBsLkVK8TkZFPR1fwgN87W3Liw/view?usp=sharing
AI Document Note Generator from Folder,"Automates note creation by monitoring a folder for new docs (PDF, DOCX, TEXT), extracting and summarizing content using Mistral Cloud LLM, LangChain text splitter, and Qdrant vector store. Generates study guides, timelines, and briefings, then exports files locally.",https://drive.google.com/file/d/1uax4d2yJslyJr6bQdZ0N4UrbMa3GLn1v/view?usp=sharing
Auto-Post to 9 Social Platforms,"Automates video publishing across Instagram, YouTube, TikTok, Facebook, LinkedIn, Threads, Twitter, Bluesky, and Pinterest using n8n, Google Sheets, and Blotato API. Scheduled to fetch video data, upload it, then post simultaneously to all platforms without manual effort.",https://drive.google.com/file/d/1dyTJ5jzu0josouC95BeqE8t-Um1BeBth/view?usp=sharing
Google Drive Document QA with Pinecone & OpenAI,"Automates Q&A on documents fetched from Google Drive by indexing text chunks into Pinecone vector DB using OpenAI embeddings. Supports chat queries with contextual answers and citations. Tech stack: Google Drive API, Pinecone vector DB, OpenAI embeddings & chat models, n8n automation.",https://drive.google.com/file/d/1yOFzU7PZTteWZyAyrYTw3az0eyCwcgWc/view?usp=sharing
Audio Transcription and Summary with OpenAI & Google Drive,"Automates audio file transcription and summarization using OpenAI's API, stores raw and processed transcripts as JSON and markdown in Google Drive, and sends notifications via Gmail and Telegram. Includes optional user approval and advanced transcript structuring.",https://drive.google.com/file/d/1Qf08DLJguyxRdMGFXXZolIqtrbmAlPu2/view?usp=sharing
AI-Powered Gmail Reply Draft Automation,"Automates email reply drafting by fetching Gmail threads with specific labels, sending email content to OpenAI Assistant for a reply, generating HTML, and saving drafts in Gmail. Utilizes Gmail API, OpenAI API, and n8n automation platform.",https://drive.google.com/file/d/1iYNyHuEJgzip_GDgfUE8a08P8ARE82on/view?usp=sharing
AI-Powered Dynamic User Interview Workflow,"Automates AI-driven user interviews using n8n forms, Groq LLM, Redis session management (via Upstash), and Google Sheets for transcript storage. It dynamically asks interview questions, records answers in sessions, and displays transcripts on completion.",https://drive.google.com/file/d/1vjQQ1x1_PUTKmVL4cwtn3R7b0i8j9fc9/view?usp=sharing
Adaptive RAG Query Processor,"An n8n workflow utilizing Google Gemini and Qdrant vector store to classify user queries into Factual, Analytical, Opinion, or Contextual types, and adaptively retrieve and generate precise answers with tailored strategies for each query type.",https://drive.google.com/file/d/1Z1K1ajwMV52JAjvpwQICgb0dm85R7sUt/view?usp=sharing
Trustpilot Reviews Insight Generator,"Automates scraping Trustpilot reviews, stores embeddings in Qdrant vector DB, clusters reviews using K-means, summarizes insights via OpenAI GPT-4, and exports results to Google Sheets. Stack: n8n (automation), Trustpilot (reviews), Qdrant (vector DB), OpenAI (LLM), Google Sheets.",https://drive.google.com/file/d/1R_vAvxeQ4CKJPoWvcAKA_WCt836RhZcc/view?usp=sharing
AI-Powered Gmail Spam & Marketing Filter,"An n8n workflow that automates Gmail inbox cleaning by classifying emails as unwanted, marketing, or spam using Google Gemini AI. It deletes flagged emails and sends Telegram notifications about deletions or skips. Integrates Gmail API, Google PaLM AI, and Telegram API.",https://drive.google.com/file/d/1KnuY-yf_ItRVRTwBfyOHojwlao2YBcTI/view?usp=sharing
Tech Radar AI Insight & Sync,"Automates syncing Tech Radar data from Google Sheets into MySQL and Google Docs, enriches it using Google Gemini embeddings and Pinecone vector store, and provides AI-powered querying via RAG and SQL agents for strategic tech adoption insights across multiple companies.",https://drive.google.com/file/d/1noMktq4pv5QYsCFbEIs9uIv0fnWnw-TP/view?usp=sharing
AI-Powered Incident Management with NocoDB,"Automates incident ticketing by integrating NocoDB for data storage, OpenAI GPT-4o-mini for AI-driven incident categorization, Slack and SMTP for notifications. Streamlines issue reporting, AI prioritization, and timely alerts for clients and assignees.",https://drive.google.com/file/d/10lbyXoOaqKshvD7DoUsZJ6G7vvhNwkLf/view?usp=sharing
AI-Driven HR Job Application Workflow,"Automates job applications with a custom form, uploads CVs to Google Drive, stores data in Airtable, uses OpenAI GPT for candidate scoring, generates interview questions, emails candidates, schedules interviews via Google Calendar, and tracks hiring stages.",https://drive.google.com/file/d/1ATFIVDyO3Ds1EJSJaYbF_PMsNJ-y6F54/view?usp=sharing
AI-Powered Resume & Interview Screening,"Automates hiring by extracting data from resumes submitted via forms, scoring candidates using Google Gemini LLM, ElevenLabs AI voice interviews, and updating Notion ATS & Google Sheets for holistic candidate evaluation and interview management.",https://drive.google.com/file/d/1BRigEHFBBVJUxeeSBf-u9NFHLmo7np3g/view?usp=sharing
Automated AI CV Screening & Notification,"This n8n workflow automates candidate CV screening using Google Gemini (PaLM) AI for resume analysis and ratings, sends email confirmations to applicants and notifications to HR, and logs candidate data in Google Sheets. It integrates Gmail, Google Sheets, PDF extraction, and LangChain AI models to streamline HR processes.",https://drive.google.com/file/d/1IfVsYudASI4fL8sqTTQ2rao5Zcz1ProL/view?usp=sharing
Airtable to telli AI Voice Call Automation,"Automate scheduling AI voice-agent calls by syncing Airtable CRM contacts with telli's API. Uses Airtable Trigger node, HTTP requests to telli's /add-contact and /schedule-call endpoints. Ideal for lead qualification, reminders, and feedback calls.",https://drive.google.com/file/d/1dBtEmw7oLUoOp01L2_Tc2lPtmHQuZUyr/view?usp=sharing
WP CF7 Contact Form Auto Response & Classification,"Automates classification and drafting of responses to WordPress Contact Form 7 inquiries using Google Gemini AI and Gmail API. Saves categorized responses to Google Sheets, streamlining customer support for businesses handling diverse requests.",https://drive.google.com/file/d/1ZRD1IoM5uHsB_x_n8AgvjA6hZOxLSWE_/view?usp=sharing
Gmail AI Auto-Responder Draft Creator,"Automates Gmail replies by detecting if an incoming email needs a response using OpenAI GPT-4o, then drafts professional replies in the thread via Gmail API. Utilizes n8n workflow with Gmail OAuth2, LangChain nodes, and OpenAI GPT models for smart email management.",https://drive.google.com/file/d/1x4WIOgP-MQkAQ4bRLcI-SxOhZU9ypKfk/view?usp=sharing
AI Web Search Agent with Memory,"An n8n workflow combining OpenAI's GPT-4o-mini, SearchAPI.io, and LangChain to create an AI agent that performs web searches on demand. It uses SearchAPI as a tool and retains recent chat context with a sliding memory buffer for smarter responses.",https://drive.google.com/file/d/1GtCLrvWEVMpjjLCQ-mxqwSBsI_4a-mQy/view?usp=sharing
Notion to Pinecone Vector Index via Google Gemini,"Automates capturing new Notion pages, filters out non-text blocks, concatenates content, generates 768-dim embeddings using Google Gemini (PaLM) API, and inserts vectors with metadata into Pinecone vector store for semantic search and retrieval.",https://drive.google.com/file/d/1BP9Palie4R2cZzykn0Gw7FSjbzHHZV5N/view?usp=sharing
Notion to Linear Issue Importer,"Automates issue creation in Linear from Notion blocks. Uses Notion API to fetch tasks, OpenAI GPT-4 to shorten titles, and Linear GraphQL API to create issues and assign team members based on extracted data. Ideal for integrating task management between Notion and Linear.",https://drive.google.com/file/d/1NM4FEldg9hZSB02DkFQFK-VPaeZui8MQ/view?usp=sharing
Spotify Track Archiving & AI Playlist Classifier,"Automate monthly archiving of Spotify liked tracks into Google Sheets, enrich with Spotify audio features, and classify tracks into playlists using Anthropic Claude 3.5 AI. Integrates Spotify API, Google Sheets, and AI for seamless music organization and historical tracking.",https://drive.google.com/file/d/1ldApStX_bRU-c5ThPRboubT6WAXPKM3k/view?usp=sharing
TechFin Customer Support Automation,"Automates customer support by integrating Voiceflow, Zendesk, Google Sheets, Google Calendar, and Airtable via n8n workflows. It fetches customer data, creates Zendesk tickets, schedules meetings, and logs transcripts for product analysis, streamlining tech customer success processes.",https://drive.google.com/file/d/1ym3tlznMpVnd9LDE84X-a8-wPuT76Z9n/view?usp=sharing
Selenium Web Scraper with OpenAI Analysis,"An advanced n8n workflow integrating Selenium via Docker, Google Search, and OpenAI GPT-4 to extract, analyze, and retrieve web data even behind login or restricted access. Supports cookie injection, screenshots, proxy use, and AI-based info extraction for dynamic web scraping.",https://drive.google.com/file/d/1DPK1Q3lM39kZTgBhbQjqFHtJFLDux7-x/view?usp=sharing
Automated AI-Powered JIRA Issue Resolver,"An n8n workflow automates the management of unresolved JIRA issues using OpenAI GPT-4 models, Jira and Notion APIs, and Slack integration. It classifies issues, attempts AI-based resolution via knowledgebase search, performs sentiment analysis, posts comments, closes tickets, and notifies Slack channels, enhancing customer support efficiency.",https://drive.google.com/file/d/1dghdNA7WHPKJorVKzClMbGW_qcVQSmL-/view?usp=sharing
AI-Powered User Interview Workflow,"Automates user interviews with AI-driven question generation and session management using n8n forms, Langchain AI agent (Groq Chat Model), Redis for session storage, and Google Sheets for transcript saving. Efficient tool for scalable qualitative research.",https://drive.google.com/file/d/1A7a6ypiM-xHfu92FBB3EpQH67DqxXidp/view?usp=sharing
AI Meeting Prep & WhatsApp Notification,"Automates meeting preparation by checking upcoming Google Calendar events, extracting attendee details from invites, summarizing recent Gmail and LinkedIn correspondence using OpenAI GPT-4, and sending concise WhatsApp pre-meeting notifications. Integrates Google Calendar, Gmail, Apify web scraping, and WhatsApp API.",https://drive.google.com/file/d/1nD4gqj-tPzc990TwZTBBK7EavZwvp4rw/view?usp=sharing
Automated API Schema Crawler & Extractor,"An n8n workflow that automates researching API documentation for services, scraping relevant pages using Apify, extracting REST API operations with Google Gemini LLM, storing data via Qdrant vector DB, and saving results in Google Sheets and Drive. Tech stack: Google Sheets, Google Drive, Apify web scraper, Qdrant vector store, Google Gemini LLM, n8n orchestrator.",https://drive.google.com/file/d/16jp-REiKUwixJN0wCs28RAgxByHAcmUg/view?usp=sharing
Automated Candidate Shortlisting for ERPNext,"n8n workflow automates recruitment by integrating ERPNext with AI models (Google Gemini) to evaluate resumes against job descriptions, scoring and justifying candidate fit. Uses PDF extraction, HTTP API, and communication via Outlook and WhatsApp.",https://drive.google.com/file/d/1_boaOslzRmKUO27HSOIxbr1qGIR5C-AW/view?usp=sharing
Airtable PDF Data Extractor with AI,"Automates extraction of data from PDFs in Airtable using dynamic prompts and AI/LLM. Utilizes Airtable API, n8n nodes, and OpenAI models to update records based on webhook-triggered events. Ideal for enriching Airtable data with AI-powered document processing.",https://drive.google.com/file/d/1YYyFPmqydsm8qcwoHidFvEe1e1JINr8y/view?usp=sharing
AI-Powered Calendar Appointment Scheduler,"An intelligent n8n workflow using OpenAI GPT-4, Microsoft Outlook API, and Langchain to handle customer chat, check calendar availability, suggest free slots within UK business hours, and book appointments or escalate to human support with detailed email notifications.",https://drive.google.com/file/d/1i7nakAkiARY6eLLwsrp7Qbf-ehkKz7IW/view?usp=sharing
n8n DeepResearcher Automated Research,"Automates deep multi-step research using OpenAI (o3-mini) and Google Gemini LLMs, Apify web scraping, and Notion API to recursively generate, refine, and compile research insights into detailed reports in Notion. Ideal for complex topic exploration with configurable depth and breadth.",https://drive.google.com/file/d/1sEmBqMf2JrnXRatinQqzn6d6DW7LQ3h9/view?usp=sharing
AI Phone Agent with RetellAI & RAG,"An AI phone agent workflow using RetellAI for voice calls, OpenAI GPT-4o-mini for transcript summarization, RAG with Qdrant vector DB for knowledge retrieval, and Google Calendar for appointment booking. Sends summaries via Telegram and automates customer support calls effectively.",https://drive.google.com/file/d/1UX8jKSJm27aQz-32xP6nLjBVM4zB1dxu/view?usp=sharing
CallForge Sales Call AI Insights,"Automates extraction of structured insights from sales call transcripts using n8n with Azure OpenAI GPT-4o-mini models. Provides detailed marketing, sales, and product feedback analysis, competitor comparison, and integration status to support sales, marketing, and product teams.",https://drive.google.com/file/d/1h3C2sblfwcv5HGT0hCQxt6x8gV-mBNjm/view?usp=sharing
Survey Response Insights Generator,"Automates in-depth survey analysis by importing Google Sheets responses, vectorizing with OpenAI embeddings, clustering via K-means in Qdrant, and summarizing insights with GPT-4. Exports detailed sentiment and trends back to Sheets for actionable survey insights.",https://drive.google.com/file/d/1oz8TYDMYKXojo36iXZwLHuCBosC_NBtb/view?usp=sharing
Automated AI Graphic Design Workflow,"n8n workflow automates graphic design from prompt to final image review using Ideogram API, OpenAI GPT-4 for image prompt evaluation, Google Drive and Sheets for storage and logging, and Gmail for notifications. Tailored for creative teams producing audience-optimized visuals.",https://drive.google.com/file/d/1kjVUs8nCJdaCJk4qWSalekzE95wiHqSH/view?usp=sharing
UTM Link & QR Generator with GA Reports,"Automates UTM link creation with custom parameters, stores links in Airtable, generates QR codes via QuickChart, and schedules Google Analytics reports analyzed by OpenAI GPT-4. Integrates OpenAI, Airtable, Google Analytics, Gmail, and QuickChart APIs for marketing campaign tracking.",https://drive.google.com/file/d/18mrCaBn0cThDfn8kUaizlqhY5L7qaFvg/view?usp=sharing
AI-Powered Visual Regression Testing Workflow,"Automates visual regression testing by comparing webpage screenshots using Google Gemini AI vision model, Apify screenshot API, Google Drive & Sheets, and Linear for issue tracking. Detects UI changes and reports them automatically.",https://drive.google.com/file/d/1IM8rPePan9mHGnGtMilY2tOLxdBgGpkv/view?usp=sharing
AI SQL Agent with Dynamic Charting,"An n8n workflow that integrates OpenAI GPT-4 with a SQL database to answer user data queries. It dynamically determines if a chart is needed, generates Chart.js definitions via OpenAI, and produces visual charts using Quickchart.io for enhanced data analysis and visualization.",https://drive.google.com/file/d/1GUZ_vPEF8vecDK8w-26SJ1vrPB1D2u4g/view?usp=sharing
AI Workplace Discrimination Analysis,"Automates extraction and analysis of workplace discrimination patterns by scraping Glassdoor reviews using ScrapingBee, analyzing demographic ratings with OpenAI, and visualizing disparities via QuickChart. Identifies biased experiences across demographic groups with statistical insights.",https://drive.google.com/file/d/13AGIzhhbpH7YF7tFPkIkkV8CySX4CyS2/view?usp=sharing
Semantic Web Search & Result Re-Ranking,"An n8n workflow that uses Brave Search API for web queries combined with advanced LLMs (OpenAI GPT, Anthropic Claude, Google Gemini) to generate, refine, and semantically re-rank search results for precise info retrieval. Ideal for research with AI-powered query optimization and detailed result extraction.",https://drive.google.com/file/d/179U48MSltBx1MO2IBrzENt9KkI5A9flk/view?usp=sharing
AI-Powered Autonomous Research Workflow,"An advanced n8n workflow automating deep research by generating search queries via LLM (OpenRouter), querying SerpAPI (Google Search), analyzing content with Jina AI, referencing Wikipedia, and synthesizing a comprehensive report using LangChain agents and memory buffers.",https://drive.google.com/file/d/1LdTt0himkAl4Kpkw18ZiCASBSNJerYFW/view?usp=sharing
