Name,Description,Link
Eventbrite Order Event Listener,"An n8n workflow to listen for Eventbrite order events (placed, updated, refunded) using Eventbrite API via webhook trigger. Ideal for automating responses to ticket sales and order changes in an Eventbrite organization.",https://drive.google.com/file/d/1E-FousIEZ6Oh4WNcQF6OvKENwafKZiuF/view?usp=sharing
Typeform to Airtable Submission Logger,Automates capturing form responses from Typeform via webhook and appends them to an Airtable base for organized storage. Utilizes Typeform API trigger and Airtable API node in n8n. Ideal for streamlined data collection and management workflows.,https://drive.google.com/file/d/1V8aMCKZ00-EuHWdPx5Q_noaUgSAr_yuf/view?usp=sharing
Zoho CRM Data Fetch Trigger,An n8n workflow that triggers manually to fetch all records from Zoho CRM using Zoho OAuth2 API. Useful for integrating and automating CRM data retrieval.,https://drive.google.com/file/d/1XojCl6DFeWeVUkuU0yqIXz2FuD_H_TvE/view?usp=sharing
Clockify Ticket Status Sync,"An n8n workflow that syncs ticket statuses with Clockify projects via webhook triggers. It uses the Clockify API to archive or unarchive projects based on ticket status updates, automating time tracking project management for support tickets.",https://drive.google.com/file/d/1n4nf0lOFM5zfTPJXzhrbNjFoT0SBlCtT/view?usp=sharing
Fetch Completed Orders from Unleashed Software,n8n workflow to manually trigger and fetch all completed orders from Unleashed Software API using the Unleashed Software node. Ideal for inventory or order management automation setups.,https://drive.google.com/file/d/149BQ4EF6QQA3LjlIGi97TcigU7cDRRxw/view?usp=sharing
Download and Upload File via FTP,"Automates downloading a file via HTTP request and uploads it to an FTP server, then lists files on the FTP. Uses n8n's HTTP Request and FTP nodes. Enables simple file transfer automation between web and FTP storage.",https://drive.google.com/file/d/1roxpR5sWkGsR9b3nQD0T-nQ8yS9YiLNQ/view?usp=sharing
Microsoft Teams Channel Setup & Messaging,"n8n workflow automates creating and updating a Microsoft Teams channel and sending a message using Microsoft Teams OAuth2 API. Triggered manually, it integrates Microsoft Teams operations to manage team channels and post messages efficiently.",https://drive.google.com/file/d/1NPwSrezmYolwozK-BJa0tj_YLWsR8x3D/view?usp=sharing
Weather Alert SMS Notification,"Automates sending SMS alerts via Twilio based on current Berlin weather from OpenWeatherMap. Uses n8n with Cron trigger, weather API, conditional logic, and Twilio messaging to notify if 'feels_like' temperature is under 18°C.",https://drive.google.com/file/d/1wDy7BPPvOrbyuaLRzFP6FA1qg9KNYrZs/view?usp=sharing
Taiga Project Event Update Trigger,An n8n workflow that triggers notifications upon events in a specific Taiga project using the TaigaCloud API. Ideal for automating project update alerts and integrations within team workflows.,https://drive.google.com/file/d/1oY4T94PHe3FebvWpsgTRCkuR7caWMhrv/view?usp=sharing
Session Feedback Reminder via Mattermost,Automates scheduled feedback requests by fetching session details from Google Sheets and posting a customized message with a feedback link to a Mattermost channel using n8n automation.,https://drive.google.com/file/d/1a86PMWyZRP9pWxl1-bJ8lGW8dwVyojBn/view?usp=sharing
"Clockify Project, Tag & Time Entry Automation","Automates workflow in Clockify by creating a project, adding a tag, creating a time entry with details, and updating it with the project ID. Utilizes Clockify API through n8n nodes for seamless time tracking and project management automation.",https://drive.google.com/file/d/1r8yioBv8Crw2Jk4A21II-VjCrEgylAhM/view?usp=sharing
BTC Price Alert via SMS,"Automates BTC price monitoring in EUR using CoinGecko API every minute; sends an SMS alert via Twilio if the price is >= 9000 EUR. Uses cron scheduling, conditional logic (IF node), and Twilio API for messaging.",https://drive.google.com/file/d/1VreAxz7s_Z-0NZkSZg6Z3Q0QdmuZKJuW/view?usp=sharing
Web Page Scraper with FireCrawl API,An n8n workflow that takes a URL input and uses the FireCrawl API to scrape the webpage content in markdown format. It automates fetching web page data via HTTP requests and processes it for reuse in AI agents or other applications.,https://drive.google.com/file/d/1ZP_sASL0OQU1oXrSWOuVoLK_GwQ816JA/view?usp=sharing
Sitemap Reader and URL Filter,"An n8n workflow that fetches a sitemap.xml via HTTP, converts its XML to JSON, splits URLs, and filters them by criteria (e.g., PDFs). Main tools used: HTTP Request, XML node, Split Out, and Filter nodes. Useful for automated URL extraction and filtering.",https://drive.google.com/file/d/14WhSxQtYrTOGa7DNeLt7ueT22rKP6x0u/view?usp=sharing
Disk Usage Alert via Twilio SMS,"This n8n workflow monitors hard disk usage on the host machine twice daily using a shell command, and sends an SMS alert via Twilio if usage exceeds 80%. It automates system resource monitoring and alerting with Cron, Execute Command, IF, and Twilio nodes.",https://drive.google.com/file/d/1CjisibohoEK86YPg3EQvnp1WqDC9w8XU/view?usp=sharing
Zoom Meeting Creation Workflow,"An n8n workflow that automates creating a Zoom meeting using the Zoom API. Triggered manually, it leverages the Zoom node with OAuth2 authentication to set up meetings instantly within automation pipelines.",https://drive.google.com/file/d/1WnaRzGQYXTIfzQotG8vhf3FtQxYiE75_/view?usp=sharing
Create Jira Issue on Manual Trigger,"An n8n workflow that creates a new issue in Jira Software Cloud when manually triggered. It uses the n8n Jira node connected to Jira Software Cloud API, enabling quick issue creation with specified project, summary, and issue type.",https://drive.google.com/file/d/1815WNwkTubsdYV9awXlZszNdl4NxN4ed/view?usp=sharing
ISS Real-Time Position Tracker,"An n8n workflow that fetches the current International Space Station (ISS) position using the whereistheiss.at API every minute, filters out duplicate timestamps, and outputs new coordinates with timestamps for monitoring ISS position changes in real time.",https://drive.google.com/file/d/197quX9ZJgi7IqivcYincfTF7tSUnp746/view?usp=sharing
Workflow Error Notification via Mailgun,"An n8n workflow that captures runtime errors using an Error Trigger and sends detailed error reports via Mailgun email API, including error message and stack trace, to specified recipients for quick debugging.",https://drive.google.com/file/d/1c4tFOnwB6qfKuEyULPW8lk_s9zhO_sa2/view?usp=sharing
ISS Position Logger to TimescaleDB,"Automates fetching the International Space Station's live latitude, longitude, and timestamp every minute using the 'wheretheiss.at' API, then stores the data into a TimescaleDB database for time-series analysis.",https://drive.google.com/file/d/12Wdzh0t5BS4AbATJ-ke_QNSRsEL7Gy-x/view?usp=sharing
Reddit Post and Comment Automation,"Automates creating a Reddit post, fetching it, and adding a comment using n8n's Reddit node with OAuth2 credentials. Ideal for Reddit content automation workflows using n8n's automation platform and Reddit API.",https://drive.google.com/file/d/1CKtJJYXzeFwAOv_iL6lQN6UmiVYWY2Te/view?usp=sharing
Tapfiliate Affiliate Management Workflow,"Automates affiliate creation and tagging in Tapfiliate using n8n. Includes manual trigger, affiliate creation, metadata tagging, and program assignment via Tapfiliate API integration, streamlining affiliate program management.",https://drive.google.com/file/d/1w1Ayojs1qFLVq5CO7Tv0rUzx3TKC29Gv/view?usp=sharing
Typeform to Demio Webinar Registration,Automates webinar sign-ups by triggering on Typeform submissions and registering users to Demio events using their APIs. Streamlines lead capture from surveys or signup forms directly into webinar platform.,https://drive.google.com/file/d/1fNAwQdLmHICfSd4KUBYzS1b_H-y_Tn03/view?usp=sharing
Raindrop Bookmark CRUD Workflow,"An n8n workflow automating bookmark create, update, and retrieve operations using Raindrop API with OAuth2 authentication. It manages bookmark collections and individual bookmarks like creating a collection, adding docs link, updating title, and fetching bookmark details.",https://drive.google.com/file/d/15OeuS_bXl3NJ_aBfImF10CIMQa724bcm/view?usp=sharing
Strava Activity Auto-Tweet,"Automates tweeting new Strava activities using Strava API trigger and Twitter API. When a new activity is created on Strava, it tweets the activity name and distance automatically using OAuth2 and OAuth1 authentication.",https://drive.google.com/file/d/1G5NiIs1cFk4pbuclpXgiYrDtD71ZH9qK/view?usp=sharing
GoToWebinar Webinar Automation Workflow,"An n8n workflow automating webinar management in GoToWebinar API: creates a webinar, updates its description, and fetches webinar details using OAuth2 credentials. Ideal for automating webinar setups and updates seamlessly.",https://drive.google.com/file/d/1IAX7VZqA0WHZeHIXkz2WWAemGHB_fGEB/view?usp=sharing
Weather Alert Notification via SIGNL4,"Automates weather monitoring for Berlin using OpenWeatherMap API, triggers a SIGNL4 alert if the temperature drops below 25°C. Utilizes n8n's schedule and conditional nodes for timely notifications.",https://drive.google.com/file/d/11EpUdKfNE58bRryfMQOGPgGHWHpUmAdS/view?usp=sharing
Webhook to PostHog Event Tracker,An n8n workflow that receives events via a webhook and sends them to PostHog analytics using the PostHog API. Useful for real-time event tracking with no-code automation.,https://drive.google.com/file/d/1dbDkklHwlagFKt1KfPe0WWmzvVmjRdEx/view?usp=sharing
Lemlist to Mattermost Reply Notifier,"Automates notifications in Mattermost when a recipient replies to a Lemlist email campaign. Utilizes Lemlist API webhook triggers and Mattermost API to post personalized reply messages to a specified channel, streamlining sales and outreach follow-up.",https://drive.google.com/file/d/1CWYQip9dr2wMfnSS8V6m4hbknLvqlkuX/view?usp=sharing
Asana Task Creation via Webhook,An n8n workflow that creates Asana tasks triggered by HTTP requests via webhook using Asana's OAuth2 API. It automates task creation and returns a confirmation URL. Useful for integrating external systems with Asana task management.,https://drive.google.com/file/d/1dtEjzg_hrXIX0JAhN2WPipjDr8vw2Cmn/view?usp=sharing
Create Task in Asana,Automates creation of tasks in Asana using n8n workflow with manual trigger and Asana API integration. Ideal for streamlined task management within teams.,https://drive.google.com/file/d/1l_HJLaQHdDu5T60CwqTZ7wWiblLqNEvh/view?usp=sharing
Autopilot to Airtable Contact Sync,"An n8n workflow that triggers on new Autopilot contacts, extracts their first name, last name, and email, and appends them to an Airtable base. Utilizes Autopilot API for contact events and Airtable API to store contact data for easy CRM management.",https://drive.google.com/file/d/1ZNfCmm39LRB5jvyTdmonLZp6SP-P3UtN/view?usp=sharing
Random Cocktail Recipe Translator,"n8n workflow fetches a random cocktail recipe via TheCocktailDB API and translates the instructions to French using the DeepL API, automating cocktail content localization.",https://drive.google.com/file/d/1uZ6yiyFE-TmrUCwbl9v9vo4WtsgV8WhY/view?usp=sharing
Microsoft SQL Query Executor,"n8n workflow to manually trigger and execute SQL queries on Microsoft SQL Server using n8n's built-in Microsoft SQL node. Enables easy database querying via automated workflows with manual control, ideal for database admins and developers.",https://drive.google.com/file/d/1k2Bb1aatxo6ERm8o7Co-HG5J0lqd9xFC/view?usp=sharing
3D Figurine Views Generator with AI APIs,"Automates creation of 3D figurine orthographic views using Midjourney for initial 3D-style image generation and GPT-4o-Image API to produce front, side, and back views on a turnaround sheet. Built with n8n workflow automation handling HTTP requests and image URL parsing.",https://drive.google.com/file/d/18k3xteaHXr9_gwtpKSB50kuIaV1HFmnQ/view?usp=sharing
Matrix Virtual Coffee Group Organizer,"Automates weekly virtual coffee meetups by grouping Matrix chat room members into randomized small groups. Utilizes Matrix API, cron scheduling, and custom JavaScript to fetch members, shuffle, and announce groups in the room every Monday at 10 AM.",https://drive.google.com/file/d/1M69r_COU5ijnbKEiKOjHR3E7q-b3ntOW/view?usp=sharing
Paul Graham Essays Milvus AI Agent,"n8n workflow scrapes Paul Graham essays, extracts and processes text, loads to Milvus vector database, and enables AI chat with OpenAI GPT-4o mini model. Tech stack: HTTP requests, HTML parsing, LangChain tools, Milvus vector store, and OpenAI embeddings and chat APIs.",https://drive.google.com/file/d/1Jf44Xuklikp5S7psz1XQjYGFV5xtLuOT/view?usp=sharing
Line Messaging API Auto Reply & Push,"n8n workflow leveraging Line Messaging API to automatically reply to incoming Line messages using reply tokens and send push messages with user-specific Line UID. Integrates webhook listener, conditional checks, and HTTP requests for interactive chat automation.",https://drive.google.com/file/d/1mwdyiV9ihce5nq9l8OPjIW8ZpkmE6V78/view?usp=sharing
Book Data Scraper to Google Sheets,"An n8n workflow that scrapes book details from a website using HTTP request to Jina.ai endpoint, extracts structured info with OpenAI-powered Langchain nodes, and appends data (title, price, availability, image, link) into Google Sheets. Automates product price tracking.",https://drive.google.com/file/d/1lPKuwsAFpW4tvue_emHHCwnfqkN52q3n/view?usp=sharing
LangChain Workflow Retriever with OpenAI QA,An n8n workflow integrating LangChain and OpenAI API to retrieve and query data from another n8n workflow by ID. It uses LangChain's Workflow Retriever and Retrieval QA Chain with an OpenAI Chat model to answer questions based on workflow data.,https://drive.google.com/file/d/1R0_OGYc4--0zWa3dsotN-wSAzKIo3qnA/view?usp=sharing
Typeform Feedback Sentiment Alert,"Automates sentiment analysis on Typeform event feedback using AWS Comprehend and sends negative feedback alerts to Mattermost. Integrates Typeform API, AWS Comprehend for sentiment detection, and Mattermost API for messaging.",https://drive.google.com/file/d/1cKff9m473lGIwLuFyD497s6sm-RYXTc6/view?usp=sharing
n8n Workflow Auto On/Off Scheduler,Automates activation and deactivation of an n8n workflow daily at 08:00 and 20:00 using n8n API node and cron-based schedule triggers. Ideal for controlling workflow operation hours in DevOps setups with custom API credentials.,https://drive.google.com/file/d/1smmorTOO32FlsYRUF6vbk-1MNOeyX2p8/view?usp=sharing
Chat with Local LLMs via n8n & Ollama,"Interact with self-hosted Large Language Models (LLMs) using n8n workflow and Ollama API. This system captures user chat input, sends it to a local Ollama-powered LLM, and returns AI responses seamlessly within n8n, enabling private, customizable AI chats.",https://drive.google.com/file/d/1OdTD5Tg9LGZq9Dln4g9BxNraT6gd5EX6/view?usp=sharing
Webpage to Markdown & Link Extractor,n8n workflow that uses Firecrawl.dev API to convert webpage HTML into markdown and extract all links. Supports batch processing with rate limiting and integrates with custom data sources for input/output. Ideal for content extraction and AI preprocessing.,https://drive.google.com/file/d/1qFLDfMaT4hKW3gP4sMmFYtFuC6dRpPGz/view?usp=sharing
Docker WHMCS/WISECP API Backend,"An n8n workflow providing an API backend for managing Docker containers via WHMCS/WISECP integrations. Uses SSH to run bash scripts on Docker servers, managing container lifecycle, disk mounts, NGINX config, and user/password operations for containerized n8n instances.",https://drive.google.com/file/d/1AAXiFI8j_WfO6Q6GO0l1fH_yNHNahYtL/view?usp=sharing
DigitalOcean File Upload via Form,"An n8n workflow that accepts file uploads through a web form and uploads them to a DigitalOcean Spaces bucket using the S3 API with public read access. It then returns the public URL of the uploaded file. Uses n8n form trigger, S3 node, and form completion steps.",https://drive.google.com/file/d/1Zva5xXmVLnSHH8uUo8e1w2OgG6aaux3x/view?usp=sharing
PDF Merge Automation with ConvertAPI,"This n8n workflow automates downloading two remote PDF files, merging them into one using ConvertAPI's PDF merge endpoint, and saving the result locally. It integrates HTTP Request nodes for file download and the ConvertAPI for file merging, requiring API key authentication.",https://drive.google.com/file/d/1iT1Z9npoPXflKJ_B4wT0ussu8yx0WS5t/view?usp=sharing
HTML Page Generator with OpenAI Structured Output,"An n8n workflow that uses OpenAI GPT-4o to generate structured JSON UI components styled with Tailwind CSS from user queries, converts JSON to formatted HTML, and serves dynamic web pages via webhook.",https://drive.google.com/file/d/1-qMuD-Fji9oMADiBvyxHiDIYYUunO2Wu/view?usp=sharing
SQL Dataset Comparison Workflow,An n8n workflow to compare two SQL datasets using MySQL queries and the Compare Datasets node. It fetches aggregated payment data for customers from overlapping years and identifies differences based on customerNumber and year fields.,https://drive.google.com/file/d/1vD1Sh7YlsGUSizHnXehmOQE9CdhzRDOt/view?usp=sharing
Google OAuth2 Credentials Auto-Creator,"Automates creation of OAuth2 credentials for multiple Google services (Docs, Sheets, Slides, Drive, Gmail, Calendar, Contacts) in n8n using Google JSON client info and user email. Simplifies tedious manual setup with n8n API integration.",https://drive.google.com/file/d/1w2QrmgGbxt-c8gW6KmFQkeBebgYmHNAs/view?usp=sharing
Daily ProductHunt AI Launch Monitor,"This n8n workflow monitors daily ProductHunt launches related to specified products like AI Agents using Airtop API for web extraction, and sends the curated list via Slack. Automates product discovery using ProductHunt, Airtop API, and Slack integration.",https://drive.google.com/file/d/1YYMr7W_zNkFc90MA_7Feek9kLeNgXoun/view?usp=sharing
Airtable Query & AI Response in Obsidian,"This n8n workflow links Airtable data with Obsidian notes using OpenAI GPT-4 through an AI Agent. It automates querying Airtable and sends AI-processed answers back into Obsidian via webhook, enhancing note-taking with dynamic database insights.",https://drive.google.com/file/d/1a5hoYoKGfs72tbgHoFDJfc7AfY3Cies7/view?usp=sharing
GetBible Scripture Retrieval,"An n8n workflow that fetches Bible verses from the GetBible API v2 using JSON input with references, translation, and version. It processes scripture references, queries the API, and returns standardized scripture texts for dynamic integration in faith-based apps or projects.",https://drive.google.com/file/d/1RppbM-DpobBuEVm3JdCw9n8KU0YnEEAc/view?usp=sharing
Text-to-Speech Voice Call Automation,"Automates text-to-speech phone calls using the ClickSend API triggered by form submissions. Users input text, recipient number, voice, and language. Built with n8n using HTTP Request and formTrigger nodes for easy voice message delivery and notifications.",https://drive.google.com/file/d/1joZjYOSOX7jlj5B8bS03PJQyewDjhKLK/view?usp=sharing
Personal Data Extractor with Self-Hosted LLM,"An n8n workflow that extracts structured personal data from chat messages using a self-hosted Mistral NeMo LLM via Ollama API. It includes auto-fixing output parser and JSON schema validation to ensure precise extraction of user info like name, contact, and communication details.",https://drive.google.com/file/d/1m6yzLLH-lM5IZi0DIfraefmy-nUITAQX/view?usp=sharing
Amazon Keyword Suggestion & Storage Workflow,"This n8n workflow automates fetching Amazon keyword suggestions via Amazon's Completion API, cleans and aggregates keywords, and stores them in Airtable. Utilizes n8n HTTP Request, Airtable integration, and JavaScript code node for keyword processing.",https://drive.google.com/file/d/1oeU20eC8uvZuZF7jrU9aVohqB--KKpFG/view?usp=sharing
PDF Text Extraction & HTML to PDF,"An n8n workflow using CustomJS PDF Toolkit nodes to convert HTML to PDF and extract text from PDFs via URL or direct input. It automates PDF content extraction and generation steps with manual trigger initiation, suitable for document processing tasks.",https://drive.google.com/file/d/1-LqF0feHNpl9N_HivJ0S--hmC2gYYEjw/view?usp=sharing
TechCrunch Latest Articles Scraper,"n8n workflow scraping the latest 20 articles from TechCrunch using HTTP Request and HTML parsing nodes. Extracts post metadata, detailed content, images, and timestamps for use in content aggregation or analysis.",https://drive.google.com/file/d/1_lIbPwTLkXrNhTO4wcm6PzMKLWd3tw8M/view?usp=sharing
Monday.com Subitem & Linked Items Fetcher,"An n8n workflow that integrates with Monday.com API to retrieve an item's details, its subitems, and linked pulses by parsing specific columns. Uses JavaScript code nodes, splitOut, and API calls to fetch and merge detailed relational data from Monday.com boards.",https://drive.google.com/file/d/1EbQ9bkNXmLInWwLed7NnIqizv30LOSsm/view?usp=sharing
PDF Merge Automation,"Automates downloading two PDF files via HTTP requests, merges them using a custom JS PDF toolkit in n8n, and writes the merged PDF to disk. Utilizes n8n's HTTP Request, custom JS node, and file system nodes for seamless PDF processing.",https://drive.google.com/file/d/1tD41iS1hOFjr2qOn08_Px5lWca1dtRHV/view?usp=sharing
Namesilo Bulk Domain Availability Checker,"Automates checking domain name availability in bulk using Namesilo API. Supports batches up to 200 domains with rate-limit handling. Outputs results as Excel file. Built with n8n workflow using HTTP Request, JavaScript code, Wait, and Convert to Excel nodes.",https://drive.google.com/file/d/1Ydwrs6A1PDu4gBAxbh3tJJ5zhWtMZRNL/view?usp=sharing
Automated Posting to X via Airtop & n8n,"Automatically post text content on x.com using Airtop API and n8n workflow automation. It creates a browser session, opens X, types a post, and publishes it. Triggered via form submission or another workflow for seamless marketing updates.",https://drive.google.com/file/d/1srrSLsbbCfVh1V82XIAdxjrMhiSkYxR8/view?usp=sharing
API Uptime Monitor with SMS Alert,"Automates API uptime checks using scheduled HTTP requests and Twilio SMS alerts when the API status code is not 200. Built with n8n automation, leveraging HTTP Request and Twilio nodes for timely service downtime notifications.",https://drive.google.com/file/d/1v41UBfBuyM1nct-X8aElBT8MOTVzXXjL/view?usp=sharing
AI Financial Chart Analyzer Backend,"An n8n workflow backend for a Chrome extension that uses OpenAI's GPT-4o-mini model to analyze stock or cryptocurrency chart images sent via webhook. It provides simple, novice-friendly technical market analysis with disclaimers. Tech stack: n8n, OpenAI API, webhook integration.",https://drive.google.com/file/d/1yKXJUWqF6q_8pCNWLBk0IdwM5MyKao0d/view?usp=sharing
Conditional Retry Workflow with Known Error Handling,"An n8n workflow for retrying failed API calls up to 3 times, except for specific known errors (e.g., 'could not be found'). Uses wait and counter logic with Manual Trigger, If and Set nodes to manage retries and error handling, ensuring robust error flow control.",https://drive.google.com/file/d/1JI1cdPQS8xBvoQExGFSRaF09h6DOXAmt/view?usp=sharing
Perplexity AI Q&A with n8n,"This n8n workflow automates querying Perplexity AI's chat completions API using HTTP requests, setting system and user prompts, and cleaning responses. It uses generic HTTP header authentication and enables retrieval of AI-driven answers filtered by search domains, ideal for dynamic Q&A automation.",https://drive.google.com/file/d/1rmIeFhdmL6d_x1XqpgJXDSJjjCfKXqtt/view?usp=sharing
Multi-file Zip Compressor,"An n8n workflow that compresses multiple input files (images, PDFs, CSV/XLSX) into a single ZIP archive. Uses n8n's Execute Workflow Trigger, JavaScript code node for binary handling, and Compression node to produce a dated zip file as output.",https://drive.google.com/file/d/12yv7IpdJy6BcySP-94sIj1khI3GiSSg4/view?usp=sharing
n8n Keyword-Based Community Topic Tracker,"Automates tracking of new topics matching a keyword on the n8n community forum using n8n workflows. Integrates HTTP API requests to n8n community search, Google Sheets for data storage, and optional Slack and email notifications. Ideal for monitoring community discussions.",https://drive.google.com/file/d/16uEXe4lN4FmZ4uy929_bhhre97kVgM-L/view?usp=sharing
Git Commit and Push Automation,"Automates adding files, committing with a message, and pushing changes to a Git repository using n8n's Git nodes, triggered manually to streamline version control operations.",https://drive.google.com/file/d/1I1MzHs4s1kauLr0STWWuxDLCppI7d6WD/view?usp=sharing
n8n Workflow Export to Google Drive,"An n8n workflow that retrieves all workflows from an n8n instance via HTTP API with Basic Auth, processes the data, and uploads each workflow as individual JSON files to Google Drive. Uses n8n core nodes including HTTP Request, Cron, Function, Merge, and Google Drive integration for automated daily export.",https://drive.google.com/file/d/1evUYRlgKp53-GsFnXv9cmKKGg5fseN2E/view?usp=sharing
Gmail Bulk Delete Automation,"An n8n workflow that connects to Gmail via OAuth2, retrieves all emails excluding chats and unsubscribe content, and deletes them in batches of 100. Automates inbox cleanup using Gmail API within n8n automation platform.",https://drive.google.com/file/d/1S0Hz5_fB2jBzJRy0QGoLAK_3uj7pIzvb/view?usp=sharing
Daily Weather Updates via Gotify,"Automates sending daily weather updates for Berlin at 9 AM using n8n. Utilizes OpenWeatherMap API to fetch current temperature and Gotify API to deliver messages. Ideal for users wanting automated, timely weather notifications.",https://drive.google.com/file/d/1u1BVZjKvoyg7Ce98Siul2NCKL3x7Qijw/view?usp=sharing
